"Designed to be the crown jewel of the Hudson Yards development, a 150-foot-tall collection of 154 interconnected staircases known as the Vessel remains off limits."
Sad I never got to go up before it shut down
"I went up once. Before I did I would walk past it thinking ""this looks cool but it's just stairs"", but walking up it was actually kind of cool. It's a lot taller than I expected it to be, walking up was almost a hike honestly."
"Also a lot of the surfaces are reflective, so it messes with your perception as you walk up. Kind of felt like being inside that tesseract thing at the end pf Interstellar."
"""it's just stairs"" was exactly what I thought..so I never got the chance. Did take a cool pic with a friend in front with no tourists in the early COVID days, so at least I have that"
This is how I expected to feel before I walked on it as well. I didn't mind the concept of 'stairs to nowhere' because many public monuments are essentially that (see:eiffel tower).. But I didn't expect to like it as much as I did when I was in it. I have some great night shots from inside of it that look very impressive with all of the mirrored surfaces
I went up once when there was enthusiasm around it. It was so crowded I felt I could easily be pushed off by someone staring at their phone. Almost gave me a panic attack. Whoever decided to make the glass railing so low is a fucking idiot. 0/10 would not recommend unless it's almost empty
They should add an elevator
It has one but I saw it and it moves really slow
"Hmmm, I wonder if it felt like a hike because it was literally just a set of stairs out in public."
"I meant hike figuratively. As in, it felt like I had walked a very long way, as if I had just gone on a hike."
Mostly just meant that my legs were more tired than expected when I got to the top.
I understand it is not literally a hike.
“You weren’t literally walking in the woods! I got youuuu!” /s
"I was there once, someone tripped and fell and they closed part of it off for the EMTs to work. At least that is what I assumed .. maybe it was something worse."
"Did the fall down every stair all of the way to the bottom, like a Mel Brooks movie? Was it Mel Brooks?!?"
"A few people jumped, they added the glass railings but somehow that didn't work and they had to shut it down."
They even stopped people from going up it alone then some kid jumped off with his family there. That had to be horrific.
"I went around the time it was first opened they were giving tickets away for little to nothing. Steps were Very complicated, elevators were very slow and they blocked 1/2 off for ppl with disabilities (understandable because it was a long way up/down)"
I went up that first week it opened. Honestly the view from up there is nothing special. Haven't stepped foot in HY in years.
"I got a cool selfie with the camera looking up from the ground level, the experience was pretty cool. Not worth opening again because of the suicides though imo"
"You know what’s crazy, people can just go across the street and jump off the 3rd or 4th floor inside the mall for pretty much the same effect."
"Last time I was at HY a friend said something similar—we were on the top floor looking out the windows at the Vessel and he looks down and says, “What do you need that for? Take a header right here!”"
Exactly. During the holidays it gets crazy busy so they’ll still shock some overseas tourist and if they’re lucky maybe even land on one if the timings right.
Ok I’m off Reddit for the day.
That happened 2 years ago in Toronto too.
Means denial isn’t any solution.
Fully agree.
You cant escape reddit.
Those tiles have to be like $6 each and they are SOLID. It’ll be sure to splatter your brain.
People would do that in the mall I used to work at in high school. And when I lived denver for a few years there was bridge that was about 20 feet above a stream that multiple people would commit suicide by hanging themselves off of. Some people called it hangman’s bridge because it happened often enough. If people want to kill themselves somewhere public…it’s going to happen
Cherry Creek?
"Mall was in NY, bridge was near the skatepark in Denver on platt river"
"Not because the art is bad, but because humans can't control themselves."
right. people jump off the Golden Gate bridge all the time - does that make the bridge a failure?
"GGB is art, yes, but it still has a utilitarian purpose."
The Vessel does not.
Making suicide easier is pretty utilitarian.
what a waste of a perfectly good taxpayer
"Eh, they probably weren't paying that much in taxes."
"Begs the question: If they charged admission, how much would the suicidal pay to jump? $10.00? $20.00?"
"According to historical records of New New York, suicide booths are a quarter."
Adjust for inflation please
$0.00001
Suicide is bad ass
The Vessel does not.
"The Vessel is a tourist sponge. It doesn't actually take up a lot of space, and you can fit hundreds of people on it."
...are the only public art installations worth having the one's with some utilitarian purpose?
"I think the point is that the bridge hasn't failed at being a bridge, but the Vessel has failed at being an experiential observation platform because people decided it can't function as that because of people."
Precisely.
"The GGB is an iconic piece of architectural art, but it also serves its utilitarian function as a piece of critical infrastructure."
"The Vessel was touted as the ""interactive centerpiece of Hudson Yards"" (their words) and was hyped up as an experiential project for people to enjoy, but it can't do that anymore."
So it is unfair to compare a major piece of artwork that has utility to a piece of artwork where you're not even allowed to climb the stairs because it utterly failed as an interactive centerpiece.
""
"Of course not, nor did my comment say or even imply this."
You literally invented an argument I never made and then replied to it.
Not everything has to be utilitarian.
I did not say or imply otherwise.
You are trying to issue a rebuttal to a point I never made.
Literally the only thing I wrote is that you can't really compare a piece of art with a clear utilitarian function with a piece of art that has none.
Helps me look around easier
Are you comparing a piece of interactive public art with a bridge? What was a bridge constructed for? And why was the Vessel constructed?
"In case you're new to the world, The Golden Gate Bridge is one of the most photographed, painted and mythologized structures in the world. It may function as a bridge but it exists in our psyche as public art."
to answer this question:
Are you comparing a piece of interactive public art with a bridge?
yup
In case you’re new to the world
I am going to steal this and reuse it everywhere applicable from now on. What a passive aggressive badass.
🤣
"He has a point though. If the Golden Gate Bridge served no purpose other than being art, yeah they'd probably consider closing it due to the rate of suicides."
"He wasn't asking if it had artistic merit, he was stating that it had a purpose beyond the aesthetic that makes it hard to shut down."
"My dude, you do realize it’s both. It IS both."
Architecture IS art. Someone designed that and it wasn’t a copy and paste one of a million kind of bridge. Art is anything involving creative design which exists in multiple mediums….including architecture.
"Believe it or not, structures can be both. See: Brooklyn Bridge, Chrysler Building, Sydney Opera House, etc. etc."
"Anytime I see this specific OP post something in the sub, I just cringe and get ready for stupid logic from them in the replies"
"Not the idiot youre arguing, but its technically International Orange. Learned that at trivia night years ago and it lives rent free in my head, and hopefully yours now too."
"I mean, that article says the designers picked the color early in the process. That is a pretty normal time to pick colors during construction."
Also I guarantee you the architects and engineers thought of this as a piece of public art in addition to a bridge.
Is the vessel a piece of art constructed as art?
Or is it a bunch of staircases? Meant for people to climb and look over an area?
How do you post something like this but lack the ability to understand something like the Golden Gate Bridge can and is considered art?
How do this many people miss the incredibly obvious point that he's making?
The point he’s trying to make is that it was a waste of money and now is a “useless” structure. How are you missing the point that it’s not useless?
"No, his point is that the Vessel is art constructed as art, with no utilitarian purpose beyond the aesthetic, so comparisons of any kind to the Golden Gate Bridge, a key piece of infrastructure for an entire region, regarding the closures are fundamentally insane."
Thanks for saying exactly what I just said in more words. Appreciate ya.
You are getting cooked in the comments lol
"Imagine calling one of the most photographed, iconic, painted, recognizable structures in the entire world ""just a bridge."""
"Just because it has a function or even has one as its main purpose, doesn't mean it's not art."
"Otherwise, we would just call the Hive, ""stairs"""
Answers.
Yes.
To span a waterway.
For the likes.
They have nets now for that
Is that why they closed the Vessel? Were people jumping off it?
I thought it was just a victim of covid and was surprised it’s still closed.
Society gotta make suicide seem less appealing.
""
"Preventative measures should be pursued too. Nets under bridges, for example, reduce suicide rates across an entire region."
The UK saw a significant drop in suicides when they simply changed cooking gas and made it difficult to kill yourself that way.
We paid 200 million dollars to make suicide more accessible rather than spend 200 million dollars to ameliorate the suffering that can lead to suicidality directly. New York City baby
That isn't why it was built though.
My cousin Jay says it was built to receive radio transmissions from aliens in space. I have my doubts...
Imagine that.. wait we do not have to…
I’ll take the vessel
"Imagine having the opportunity not to let everyone know you value inanimate structures over human life, and then saying 'fuck it' lmao"
"No, I don’t really care about every single persons mental health and I shouldn’t have to"
This kind of sociopathy used to be taboo. We are so fucked.
I think it’s sociopathic to want to remove public art installations because some people jumped off it which they can do with literally any other readily accessible point of elevation in the city
"I didn't suggest it be removed. If you want to make up arguments you can do it alone in the shower. I do suggest that we stop investing millions in these types of useless decorative structures, and instead invest it into the types of services that improve mental health of people that live in the city. Especially given how much everyone allegedly cares about mental health and the connection to crime. Preferring hundreds of millions of dollars in ornamentation over improving or saving the lives of your fellow New Yorkers is sociopathic, yes."
Both can happen. You don’t have to spite something else to promote your own cause
Your original statement is dumb to even begin with.
"Suicide will always exist to some degree (for the foreseeable future anyway), but maybe society shouldn’t make things shittier for people and we can address growing suicide rates. “Humans can’t control themselves” is a shitty take on suicide, like it’s some personal moral failure."
"Spectacularly committing suicide by jumping off a piece of public art is wild though.  Suicide sucks, but if you're gonna do it, please don't make a big scene and traumatize a bunch of strangers."
"That said, they should just have put nets."
"I totally agree with you but we’re judging the actions of people who are literally at their wits end to the point of ending their lives. We can’t really view these actions in the view of pure logic or even thinking about other people. Why someone would do it in such a public way, I can’t even fathom, but it isn’t just coming from nowhere."
"If you ever make something that people can spectacularly commit suicide from, you can be certain that some people will take advantage of the opportunity."
Not a big fan of this whole other people can’t behave so you can’t have nice things thing we have going on.
Has anyone dived into the 9/11 memorials?
"I don't believe so, but they also intentionally designed it to be suicide-resistant.  The walls are sloped, which will slow you down, and the water is 3 feet deep, which should help cushion the impact."
A piece that can make some people think about life in such a profound level must be pretty good art.
Can't they put a net to catch anybody that jumps off?
But.... I mean come on this thing fucking sucks.
I like it. It reminds me of a bees nest.
Reminds me of gyro meat. Love it.
"Oh, I’m going to call it The Spit from now on."
I call it the Shwarma
Glad I wasn’t the only one. And yes I do like it for this reason.
""
i really like it as well. the fact that it triggers so many haters is an added bonus
I think cinnamon bagels are an abomination but if other people like them I'm OK with it.
i was in a deli just last week and some woman ordered a hot roast beef and swiss with mayo on a cinnamon raisin bagel (untoasted) and all i could think to myself was: daddy issues
"“If you see something, say something” applies everywhere."
Her safe word is “chopped cheese.”
"Bacon Egg and Cheese on a cinnamon raisin bagel is amazing, but that is absolute madness"
Idk about you but I’m more offended by the mayo then the bagel choice . What kind of monster uses mayo with red meat
So none on a burger?  A chopped cheese?  A BLT?!? Who’s the real monster?
I said what I said
You wouldn't have batted an eye if it had been toasted?
"I hear ya, I'm a total ignoramus when it comes to modern art and architecture anyway so I'm sure there are some reasons why people like it."
It looks like an early-90s computer graphics technology demo
It only sucked because you needed scheduled tickets to climb stairs to nowhere
Thank you. I hate super jaded headlines like this.
Pro tip:  It's still bad.
it's definitely bad art too though.
No its not bad art.
It can be both!!!
"i mean, it's ugly to me and a blight on our skyline but if you say so."
"Its too low to be on the skyline,."
fair enough. it's not part of the skyline but i still see it every time i'm biking on the west side highway bike path.
"For me, it's ugly, it's puny, it's industrial but without function, it seems so at odds with its surroundings and it's ultimately a stairway to nowhere, seemingly created for tourists to take selfies."
"but it IS art, for better or worse. Genuinely curious why you like it, would be interested to know if you care to share."
I think it looks striking ... I climbed it several times before it closed and the experience of being inside it was quite remarkable.  I watched it be assembled from the High Line and was fascinated.
"I don't think it needs a ""destination"" when it IS the destination."
I think the copper colored steel plating is remarkable.
I don't like that its closed.
"There's nothing wrong with creating a place for tourists to interact with things either.  New York isn't just for New Yorkers after all, never has been.   In fact, the more of them that get created the less the tourists will intrude on actual local lives in a bothersome fashion."
thanks for sharing your opinions. you and i have had very different experiences with it and that's obviously informing our like or dislike of the vessel.
i hope they figure out how to open it again so you can go back to enjoying it.
"There is no ""bad art"", only art that doesn't speak to you or art that you simply do not like. I fucking hate country music but I recognize that others love it."
"Objective qualities or the way different forms of art are evaluated, change with time. Some art that may be recognized as amateurish, poorly executed or ""bad"" as you call it, can at another time in history be recognized as a masterpiece. You're wrong, you're obnoxious, you're ignorant."
Here are a few glaring examples proving you wrong:
10 Early Scathing Reviews of Works Now Considered Masterpieces
"Kumbaya my Lord. Kumbaya. Oh, Lord Kumbaya ."
"Not really, art is subjective"
I blame the art. Most other art projects don't prompt people to throw themselves off it.
"Why don't you try to understand these people who""can't control themselves""? Why do you suppose they can't control themselves?"
We can't make the world safe for every person in it. It's not possible.
""
It is not the art piece’s fault that suicidal people jump off of tall things…
""
""
"If they hadn't figured out and accounted for what would happen if everyone stood on one side at once because something interesting was going on they wanted to watch, would you blame the people not following the 'please distribute yourselves evenly' sign? Or the designer who didn't make it sturdy enough that it didn't depend on individual humans making good decisions on an ongoing basis to keep it stable?"
"Time to knock down all those multi-story buildings too then i guess. Convert all the bridges to tunnels too while we’re at it. Oh and no more trains, can’t risk people jumping in front of them."
"The truth is that if someone really wanted to end their own life, all they have to do is intentionally overdose. We need to focus on the root cause of suicide, not the means of doing it."
Uh why not both? Why make an attractive place for big showy suicides readily available until such time as we get our mental health care system straightened out in this country?
""
You’re really doubling down on this lol. You’re now arguing that all national parks with a tall drop and all balconies around the world be locked down.
It’s so fascinating to see someone dig into a nonsensical position
""
"When them piece of art is a set of stairs without any safety features inside to prevent people from jumping, it is the art piece's fault. Especially after the second time it happens. And the third. And the fourth. And now it's closed and nobody can walk up the $200,000,000 stairs."
"If someone jumps off a balcony is it the architects fault, too?"
"Theoretically if an architect decided to include balconies on a high rise psych ward, then yes."
"It provided the code-specified guardrail at the code-specified height. If you think the codes are too relaxed, then write to your congressman to lobby for more stringent codes. But you’re asking an architect to provide more than what is required by code? Are you equally angry that bridges and mall atriums don’t over-provide when it comes to guardrail provisions?"
You seem to just be mad at this art piece in general because the logic of your critique seems to be based on your feelings and not the actual factual conditions.
"It's still not it's fault that people choose to commit suicide there. If there were unsafe structural problems causing injury, that would be one thing but it's people jumping off out of their own volition. If you wanna blame anyone, blame the security in charge of keeping people safe or blame whoever's managing that art piece."
""
"Read my last comment again, but critically think at the same time as you read it."
r/woosh
"How the fuck does that make any sense… and even if you were right, what do you propose we do? Put cages around every staircase, elevated pathway, bridge, etc in the city? If someone jumps, you don’t blame the bridge or its architect for not putting some pillows at the bottom of it."
"If you wanna be mad, be mad at how society has failed these people. Who knows why, but it probably has something to do with how hostile and shit this world has become to live in."
"without any safety features inside to prevent people from jumping,"
"Such as, what... all the guard rails it has? The guard rails that are just as tall as those on every balcony on every high-rise in the city."
"What do you want, nets?"
Is society not art that is failing… mental healthcare is out of reach to most people! We are fighting each other trying to decide whether or not living wage is required for full time workers. Society blames inflation on minimum wage workers ignoring million dollar + compensations and corporate profits but it must be the minimum wage workers the reason why a house now cost over 800k in NYC
"Is the Eiffel Tower ""bad public art"" because over 300 people have committed suicide off of it since it was built?"
It’s aesthetically offensive
Also because the art is bad.
"No, the art is bad"
The art is bad though
"Why do some people get so up in arms about public spaces/art/installations/etc. that don't serve a specific purpose? I don't want to live in a place that is 100% utilitarian, so things like this can help, as can parks, attractive architecture, urban trees, and public squares."
This! It's like saying that the High-Line is dumb because it does not help my commute. Art is what you make of it. Some people like detailed sculptures and some like a dot on canvas. Not everyone has to absolutely love every expression out there.
"I mean, the Highline literally made my commute so much nicer, coming out of the Hudson Yards station and walking down the Highline instead of on the street is so much more relaxing (before I started bicycling to work which is even better)."
"Personally the most unreal part of Hudson Yards is the part no one sees, the fact that they Leveled out 33rd street between 10th and 11th instead of the Hill it used to be."
"Yeah.  I don't care for most modern art, but I understand that lots of people do like it and appreciate it."
The high line is dumb because it replaced an elevated freight rail facility with a tourist trap. The carbon cost of that stupid walking trail is incalculable.
"I don’t understand, what is the carbon cost from? And it’s not as if it would still be an active railroad line if the high line didn’t replace it"
"They didn't shut down the rail to make a park, the tracks were already long out of use and the whole thing was set to be demolished."
"Yes, but they could have been rehabilitated and put back into use and thereby saved thousands of truck trips into the city each day. The carbon savings of returning to freight rail cargo would be enormous, to say nothing of the maintenance savings given that tractor trailers do hundreds of thousands of times as much damage to roads per mile travelled."
"The ""carbon cost"" of converting abandoned infrastructure to a park full of plants?  Never heard of the addition of plants being referred to as a carbon cost."
https://www.thehighline.org/history/
"Exactly.  THere are some art installations I don't really care for, but I don't care that they are there.  It's whatever."
I don’t mind that the vessel doesn’t serve a functional purpose.
I DO mind that a giant climbable sculpture got approved without any suicide prevention measures and now it’s inaccessible because people committed suicide on it.
"It was literally just a matter of time, the outcome of someone eventually using it to off themselves was as predictable as it was inevitable."
The location of the vessel sucks too. It’s just surrounded by buildings taller than it.
It does serve a functional purpose. That purpose isn’t what society approves of so it was shut down.
I really don’t buy the whole “it was an oversight” thing.
Could you rephrase that? Or are you actually suggesting that developers purposely built this as a means for people to commit suicide?
"Agreed.  Honestly I think I like it better as just a sculpture than when it was an ""Instagram moment"" destination."
To me it’s a suicide memorial. Just like Bobst Library at NYU.
"Yeah, people used to make grim jokes about the 'Bobst Diving Team' when I was at school"
"Same. First they put up plexi and that didn’t work, and now it’s like an artist-designed metal screen blocking any way of jumping down. Pretty sure that solved the problem, fortunately."
"I visited once, when they had the plexiglass, and the original stair railings were way too short. I’m surprised more falls didn’t happen in the past, including accidental."
"It felt so nice and airy inside with the original railings, though - definitely miss that."
Yeah I never understood how people felt safe when there were just the original railings. I think the plexi was always there when I was a student starting in 2005 but I remember being surprised by how easy it’d be to fall over without it.
"I started at NYU in 1997, and while getting an orientation tour of Bobst, the guide pointed out the suicide-discouragement built into the architecture: the brass(?) railings were shaped in such a way that if you looked down the edge of them (as you would if you were grasping them to jump over), you would see the shape of a Christian cross. Not like an ""X"", but an actual cross with the appropriate dimensions. So, if you were Christian I guess you were supposed to see it as a sign not to jump. If that didn't work, the marble flooring at the bottom was tiled in such a way to create an illusion like spikes coming up at you when seen from above. I'm not sure how discouraging that would be if you were already planning to die, but that was the idea apparently."
"At this time there were no physical barriers to jumping, and obviously that didn't work."
"Ah wow I had no idea about the cross thing! Definitely knew about the spike pattern though. Always thought that was cool, in a morbid sense I suppose."
