Document,Topic,roberta_polarity,roberta_sentiment
"It's an attraction, not an office building. So? You're talking ROI, which likely is favorable. That also makes the distinction of whether it was a paid, commissioned work or a gift less important.",topic_9,-0.13909243,Neutral
"Nobody said that, also this isn't a building",topic_9,-0.48538113,Negative
Oh ofcourse lets just have pure brutalism architecture with no design or meaning other than saving money.,topic_9,-0.65840906,Negative
Lol brutalism is super expensive. Concrete is not cheap. And it's super design/aesthetics focused. That was part of the problem. It was more concerned with making cool forms out of concrete than making high functioning spaces that are a pleasure to occupy.,topic_9,-0.7013741,Negative
Wow man that’s honestly such an insightful point. That poor architect :( you are a good human,topic_9,0.4462436,Positive
"Everyone knew this would happen the minute its design was revealed. Kind of incredible that they went ahead with it, without major revisions",topic_9,0.6106769,Positive
"In any case, it's better here than in front of a subway train (i.e. the usual).",topic_9,0.66403675,Positive
"Honestly I hate this thing. I love the design, but it was privately funded and the billionaire (Stephen Ross) who paid for it refuses to make the barriers higher because it'll make the view worse. The architect submitted designs for higher barriers after the 2nd suicide just to have them ignored.",topic_9,-0.7211323,Negative
"Well, it was built with iron(y) by design",topic_9,-0.049958378,Neutral
Before you shit on our city make sure you’re familiar with the fundamentals. This wasn’t built by us. This was built by a private property owner.,topic_9,-0.6858091,Negative
"That whole parcel of land is just one big spending flex. It’s built on top of an active rail yard (hence the name) and its hollow underneath, it’s basically a floating platform with massive buildings on top.",topic_9,-0.1586485,Neutral
I mean I love architecture as much as the next nerd( concept art was what defined my career)... but seriously?,topic_9,0.66403675,Positive
Shame on the architect. Shame on anybody who financed this. What a waste of money.,topic_9,-0.7352223,Negative
The architect is just the designer. They're an artist who needed to make a living and probably had little to do with everything else.,topic_9,-0.31852075,Negative
"You need to say ""shame on anyone who approved on the overall project""",topic_9,-0.7013741,Negative
The tallest building in the world was $1.5b in Dubai I think. So 7.5 of these could buy that (using your discount slave labour membership card).,topic_9,0.1877462,Neutral
It’s basically a lookout platform,topic_9,0.039978683,Neutral
"Yeah, this is the correct answer. It's not like the city built it and there would be a whole other mess of complications to get privately funded infrastructure built and maintained.",topic_9,-0.45421642,Negative
That is  skateboarders dream!,topic_9,0.69625765,Positive
That’s not a city designer’s problem. That’s a government problem.,topic_9,-0.64692944,Negative
Just build a trampoline at the bottom,topic_9,-0.09966799,Neutral
Architect: this design is beautiful and will attract people,topic_9,0.7530659,Positive
"So, you’re saying the architect did a killer job?",topic_9,-0.69625765,Negative
"Not gonna lie... as a geek, if an architect brought me a design like this to build? The first thing I'd think is ""Okay, what ritual is this guy trying to perform and how many need to die?""",topic_9,-0.49298793,Negative
It has major cultist sacrifice vibes.,topic_9,-0.7013741,Negative
"Also beautiful construction and placement,  aside from the death game",topic_9,0.7442769,Positive
Didn't they consider the ramifications before designing and building it?,topic_9,-0.4462436,Negative
What was the point of building this?,topic_9,-0.5849799,Negative
An architectural wank fest.,topic_9,-0.680476,Negative
Found the architect.,topic_9,0.23549576,Neutral
What's the point of the statue of liberty?,topic_9,-0.48538113,Negative
Build it and they will...go?,topic_9,-0.19737534,Neutral
Proof yet again that so much of our built-up environment is anti-human.,topic_9,-0.71629786,Negative
What assfucker designed and built this monstrosity?,topic_9,-0.7305939,Negative
Dial up any building erected between 1955 and 1995.,topic_9,-0.0599281,Neutral
This bitch beautiful…… YEET,topic_9,0.73978305,Positive
One of my dads friends was the lead designer of that actually,topic_9,0.06988589,Neutral
Where's it at? For...scientific reasons,topic_9,0.0,Neutral
I wonder how the architect of this ugly abomination feels knowing that the sole purpose it has was triggering people with suicidal thoughts.,topic_9,-0.7352223,Negative
white guy blinking gif,topic_9,-0.1586485,Neutral
When I seen this structure i did wonder if this would happen given how it is...suppose my curiosity was correcr,topic_9,-0.03997868,Neutral
"If you build it, they will come.",topic_9,0.492988,Positive
Place is built for some serious cardio,topic_9,0.22602834,Neutral
Why do architects not understand what a fear of heights is?,topic_9,-0.6169093,Negative
That looks like the type of architecture in my dreams when I'm in a hurry and keep getting lost.,topic_9,-0.30950692,Negative
looks like something I'd build in cities skylines,topic_9,0.27290508,Positive
Whoever built this definitely Halo's,topic_9,0.099668,Neutral
"Who designed this monstrosity and thought cool let’s build it. Obviously a rich white guy. I looked it up just in case🙄 Thomas Alexander Heatherwick 17 February 1970 (age 51) London, Englan",topic_9,-0.65840906,Negative
"It's cool, but not functional at all. I'm sure the streets are still covered in potholes",topic_9,-0.7113937,Negative
designed by Thomas Heatherwick studios.,topic_9,0.13909245,Neutral
"It's beautiful, but architects must understand humans are susceptible to bad ideas. So those ideas must be accounted for in the design. That would look terrible wrapped in glass. Maby a different color glass in each hexagon could be cool.",topic_9,-0.5783634,Negative
let me guss Japan,topic_9,-0.03997867,Neutral
If you build it they will come,topic_9,0.5783634,Positive
Idk who thought this was a good idea,topic_9,-0.7064193,Negative
I went on it and honestly it was underwhelming. Probably because sir was also extremely cold,topic_9,-0.7113937,Negative
Probably because the get lost and can't escape,topic_9,-0.55112803,Negative
I guess design before safety will be next century's thing.,topic_9,-0.38847268,Negative
All I can say is it's beautiful architecture.,topic_9,0.7442769,Positive
I was just thinking today how beautiful it would look if it was covered in vegetation.,topic_9,0.72589743,Positive
It is a gorgeous structure tho,topic_9,0.7113938,Positive
They should build more!,topic_9,0.23549575,Neutral
Wank architect factor 11,topic_9,-0.65270674,Negative
What a beautiful architectural design! So unique and interesting.,topic_9,0.7487043,Positive
Only 4 deaths in 2 years. I’m guessing the city fucked up letting this thing get built and want to make way for a more tax paying building to move in. A building of stairs pays much less than a building of apartments in taxes.,topic_9,-0.71629786,Negative
The industrial revolution...,topic_9,0.17808086,Neutral
But the bullseye is soooo tempting.,topic_9,0.66959023,Positive
"its beautiful, but unsafe for a work environment. as someone who get unwanted thoughts, id stay far away, thats for sure",topic_9,-0.37136024,Negative
I mean… whoever built that MUST have known…,topic_9,-0.27290508,Negative
Sub for Industrial Architecture?,topic_9,0.029991005,Neutral
Oof this is like an AI designed a better sacrificial temple after studying the aztecs and mayans,topic_9,-0.06988588,Neutral
"That’s literally my worst nightmare, being at the top of that",topic_9,-0.7352223,Negative
A funeral service company would be a great business next to the building.,topic_9,0.53704953,Positive
"I mean, look at it... It's beat.....",topic_9,0.2069665,Neutral
Survival of the fitness,topic_9,0.14888504,Neutral
"Rumor has it, it was built for the intention to collect souls. That’s what some random dude said the last time I visited. Shit wouldn’t be surprised if it’s true. It’s very captivating.",topic_9,0.6910695,Positive
I literally saw this coming and commented about it back when it was built,topic_9,0.069885895,Neutral
I want to try and build this in minecraft,topic_9,0.47770005,Positive
Deaths aside that is an incredibly cool structure,topic_9,0.62914515,Positive
Shame since it's such a neat looking structure.,topic_9,-0.62306535,Negative
What about all the buildings with rooftop access?,topic_9,0.03997868,Neutral
I heard a story about a guy who killed himself jumping out of the IDS tower in Minneapolis. My company had regular deliveries to the building and one of our delivery guys heard the story from a secretary who was there when it happened.,topic_9,-0.5370496,Negative
"Eventually he told us that it was his project and that he was the lead architect (his name was Lawrence), and that he was talking to people to get feedback for his team back in London.",topic_9,0.099667996,Neutral
He did design it but he also isn't actually a licensed architect,topic_9,-0.31852075,Negative
"It's an example of extremely object-based design in an urban design context. You could copy paste this anywhere in the world and it would fit in just as much as it does here (except the top of some hill overlooking some unique scenery). Not because of some universal utility but because of universal lack of engagement with it's surroundings. ""I made this object pretty and now everyone will like and interact with it"" is a sculptural attitude, not an urban one. The form itself still feels like the classic case of ""boy that rendering looks pretty"".",topic_9,-0.1877462,Neutral
This is a godforsaken eyesore and a slight upon the core ideals of environmental design.,topic_9,-0.72589743,Negative
"Overall its just a poorly considered collection of trophy buildings, with insufficient thought to integrating it with the city",topic_9,-0.680476,Negative
"I didn’t really get why this particular structure was so hated, but seeing it from this angle really makes it look unpleasant.",topic_9,-0.71629786,Negative
"It is useful and beneficial, therefore it has utility.",topic_9,0.7013741,Positive
How is it useful?,topic_9,-0.009999672,Neutral
useful,topic_9,-0.4300842,Negative
That's actually a real building. Gimme a second to find it,topic_9,0.21651806,Neutral
And the architect refused to add safety barriers even after several deaths.,topic_9,-0.67506987,Negative
I gotta change my number,topic_9,-0.119427286,Neutral
"It's a design failure, and they refuse any alterations to make it safer. It's a white elephant.",topic_9,-0.7305939,Negative
The Wastebasket,topic_9,-0.26362485,Negative
"I'm rapidly coming to the conclusion that Thomas Heatherwick is a bit of a charlatan. Or at best, an artist playing at being an architect.",topic_9,-0.6910695,Negative
The name of the building is literally in the title. What more of a hint do you need?,topic_9,-0.1877462,Neutral
im a fan of geometry (in a visual aspect); i find this architecture vastly satisfying!,topic_9,0.7573623,Positive
I've been walking past this nonexisting building for like 3 years. Any other facts you can hit us with?,topic_9,-0.46211714,Negative
It’s an art installation that’s free entry. Cool structure.,topic_9,0.72589743,Positive
I hate this building,topic_9,-0.7064193,Negative
If only the architects could’ve predicted this! /s,topic_9,-0.4699452,Negative
Nobody designed natural lookout points. There's different standards for architecture.,topic_9,-0.3004371,Negative
"Me: ""Many lookout points have been closed down, and anyways there's different standards for architecture, compared to natural formations."" You: ""WELL ONE OF THEM HASN'T BEEN CLOSED DOWN! CHECKMATE, LIBERAL!""",topic_9,-0.4381993,Negative
crying at the comparison between this art installation and one of the 7 natural wonders of the world,topic_9,-0.2069665,Neutral
Oh they just built one,topic_9,0.14888503,Neutral
"OMG, talk about nightmare fuel 😳",topic_9,-0.6858091,Negative
"Wait, you tryin' to tell me they designed a high building without safety measures usually prescribed for high buildings?",topic_9,-0.5441271,Negative
"I used to work in the building right next to this and this really isn't high enough to give you good views of the city. But beautiful structure regardless, unfortunate that it had to be closed.",topic_9,-0.345214,Negative
They obviously didn’t have any Late Millennial/Gen Z design staff on that project our depressed asses would have caught that issue immediately.,topic_9,-0.7211323,Negative
People are just easy and simple minded to resist the facile and reductive idea that it’s somehow the architecture’s fault.,topic_9,-0.45421642,Negative
"The fact many such kindly, well-meaning folks mistakenly blame the structure rather than alleviate any part of the real problem means their efforts fall short despite them feeling they’ve accomplished something and stop.",topic_9,-0.680476,Negative
Last I read this was going to ruin the architects vision so they did not agree to it,topic_9,-0.65270674,Negative
This architecture true crime tho,topic_9,-0.67506987,Negative
Ah a Heatherwick.,topic_9,-0.0099996645,Neutral
When I first saw this thing it was still under construction. I thought it would be the interior or something of another skyscraper. What is the point of this building?,topic_9,-0.64692944,Negative
"To my eyes it occupies the site. It's ""Hey, look at me"" and serves no use for humans to live better in the city, like a basketball court with food trucks surrounding it under a shady grove of trees with benches waiting to be polished by the multitude of interesting backsides. Think that's not so cool, and so passe, then you are so lucky.",topic_9,-0.597982,Negative
who but everyone could have imagined that a stairway to nowhere would be doomed to failure,topic_9,-0.5915194,Negative
Ridiculous structure. Completely  useless.,topic_9,-0.7305939,Negative
This useless structure no one asked for.,topic_9,-0.7305939,Negative
Could be bad Feng Shui. I wonder if anyone has been looking into this.,topic_9,-0.64692944,Negative
Underground.  Everything is being built over the tracks.,topic_9,0.009999668,Neutral
Why did they choose for white on the structure? That will probably look disgustingly dirty after a while. Dark brown wouldve been better imo,topic_9,-0.72589743,Negative
God I hate this structure,topic_9,-0.7064193,Negative
"I think architecture should have a purpose alongside the artistic value of something, not to say it isn’t pleasant to look at but there’s nothing behind that",topic_9,-0.4300842,Negative
Is Dallas known for pretentious meaningless architecture? (I’ve never been),topic_9,-0.51535934,Negative
That is some sensational web design.,topic_9,0.73978305,Positive
"Right. I would hesitate calling it Architecture. It may be architectural, but it’s mostly a traversable sculpture.",topic_9,-0.38847268,Negative
"But you could also consider it an architectural folly, which is definitely a thing",topic_9,-0.5441271,Negative
That is true I suppose. Yes it could be considered a contemporary folly definitely.,topic_9,-0.4053213,Negative
Tbh the line is naturally quite blurry between architecture and sculpture.,topic_9,-0.4699452,Negative
"Also, I'm of the opinion architecture is art with purpose, as I see it as a design discipline, so if an entire structure has no purpose, well, it's pointless and I don't see why you'd build it as they'res countless better things that could appear as nice AND serve a function.",topic_9,-0.6106769,Negative
So...there is a point.,topic_9,0.01999733,Neutral
What these 3rd parties will do with this information is more suspect.,topic_9,-0.55112803,Negative
"My follow up was simply an observation. I'm an architect, and I have a store of trivia on the subject, so I thought I would share. It wasn't agenda driven.",topic_9,0.09966799,Neutral
"Seriously. To me, it’s the perfect architectural folly for the social media age",topic_9,-0.2913126,Negative
Miniquad FPVers dream,topic_9,0.21651806,Neutral
"I think it’s honestly meant to engage the social media generation. So many people taking selfies, instagramming and shouting to each other to look across and up at their friends. Also the underside of the ramps is clad with highly reflective copper/brass paneling and actually throws off some very cool reflections/optical illusions when you’re looking up",topic_9,0.36270747,Positive
Quite an aesthetically complex layout of platforms!,topic_9,0.5849799,Positive
"That's funny, but I do have a weird fascination with 'Triumphal Arches'.  Partly begot of studying Ancient Rome, where we don't have nearly as much written down about compared to say, WW2, so you have to study everything you can, and a big part that still survives are the monuments the oligarchs/emperors built for themselves. They generally are made to tell a story.",topic_9,0.019997345,Neutral
"Then people like Napoleon built them, and there was quite a resurgence post-rennisiance of more of them in Europe.  The Arc de Triumphe in Paris is probably the most famous modern one, and the Monument to the Revolution in Mexico City is even larger an example of the form used in a much different, more modern context.",topic_9,0.46211717,Positive
i agree! its definitely the repetitive nature of the structure,topic_9,-0.38847268,Negative
Architect: ...it's genius,topic_9,0.7113937,Positive
And the architect who designed it passed away yesterday,topic_9,-0.680476,Negative
"Lazy is a very good way to describe the transition, yeah that design is definitely more coherent and interesting.",topic_9,0.7211323,Positive
EDIT: I do hope the standards of the finishes in those buildings are slightly higher than on the Wastebasket,topic_9,0.2821348,Positive
Your friend is a complete cockwomble.,topic_9,-0.7211323,Negative
I work in a financial firm but can't necessarily tell what others in the building do.,topic_9,-0.049958374,Neutral
"Hey everybody. Just wanted to say that as an architecture student, I find the discussion here very stimulating.",topic_9,0.7487043,Positive
"I read about this in the Guardian. I have had a misfortune to live in badly planned areas like this, with buildings with shitty architecture. It is really sad that developers and architects have become so arrogant that they can't even comprehend what beauty is. And then we are stuck with shit like this, because there's a huge sunk cost to these projects, no matter how ridiculous it looks.",topic_9,-0.73978305,Negative
Thomas Heatherwick's Leaking Bowl (Thomas Heatherwick is the designer),topic_9,0.16838105,Neutral
The Butt plug designed by asshole,topic_9,-0.7113937,Negative
Toilet Plumber's Nightmare,topic_9,-0.6043678,Negative
Structure Do Little,topic_9,-0.009999672,Neutral
I think this would have been so much cooler had it not been done in rose gold. Copper would have been so much better in my opinion.,topic_9,0.55112803,Positive
ayy shout out CT in the building /s,topic_9,0.73978305,Positive
Also get Chrysler building and One World Trade (it was in the pre-launch trailers) back in.,topic_9,0.23549575,Neutral
"Thanks for the post OP, genuinely such a sick piece of architecture",topic_9,0.6043678,Positive
That has to be a collision mapping nightmare! But it would be pretty sweet.,topic_9,0.3884727,Positive
"Definitely the Apollo Theater, I know they left it out because of how they had to condense Harlem but it would still be cool to see, I also desperately wanna see the Chrysler Building and George Washington Bridge return, I also would love to see One WTC actually look like the real thing and lastly, an actually accessible Liberty and Ellis Island would be amazing",topic_9,0.7113937,Positive
4 Freedoms Plaza and or the Baxer Building,topic_9,0.04995837,Neutral
Helps me look around easier,topic_9,0.6169093,Positive
Architecture IS art. Someone designed that and it wasn’t a copy and paste one of a million kind of bridge. Art is anything involving creative design which exists in multiple mediums….including architecture.,topic_9,0.37136024,Positive
That isn't why it was built though.,topic_9,-0.4300842,Negative
"I hear ya, I'm a total ignoramus when it comes to modern art and architecture anyway so I'm sure there are some reasons why people like it.",topic_9,-0.19737533,Neutral
I think the copper colored steel plating is remarkable.,topic_9,0.72589743,Positive
"Theoretically if an architect decided to include balconies on a high rise psych ward, then yes.",topic_9,0.029991005,Neutral
It’s aesthetically offensive,topic_9,-0.67506987,Negative
"Agreed.  Honestly I think I like it better as just a sculpture than when it was an ""Instagram moment"" destination.",topic_9,0.680476,Positive
"Ah wow I had no idea about the cross thing! Definitely knew about the spike pattern though. Always thought that was cool, in a morbid sense I suppose.",topic_9,0.6469295,Positive
I don't hate it either. Definitely not a huge fan of it though.,topic_9,-0.4699452,Negative
Is it really a baffling idea that an object can feel large when humans interact with it but small contextually compared to how large the buildings are around it?,topic_9,-0.3713602,Negative
if I was going to design a ceremonial death machine that's kind of what I would make it look like.,topic_9,-0.29131263,Negative
"Oh, you can add the fact that with the billions they did receive, they ended up building a segregated poor building on the lowest floors of their premium condo sky scrapper during phase 1.",topic_9,-0.66959023,Negative
It’s a failure because it was designed to be climbed and now you can’t climb it.,topic_9,-0.7211323,Negative
"The designer was warned but just like the luxury nightmare that is the area, no one wanted to listen to anything but money.",topic_9,-0.5783634,Negative
"I mean, we were saying it as soon as the design was released. It didn’t need to be erected to know it was a terrible idea. Can’t fathom how things like this get a green light",topic_9,-0.7013741,Negative
"It's not a failure. It's a architecture masterpiece that unfortunately was used to commit suicide. Ppl still flock to it. All they have to do is put up a window glass shield,  (similar to what they have on the edge), on each level all around. At this rate, it just becomes a building, but atleast it won't turn into a flop.",topic_9,-0.33637556,Negative
It's a architecture masterpiece,topic_9,0.7113938,Positive
Literally everyone predicted it would be a failure.,topic_9,-0.6469295,Negative
The architect needs to stop being a tied and just allow a safety net,topic_9,-0.22602837,Neutral
