Document,Topic,roberta_polarity,roberta_sentiment
"Yes. Let's have only ugly, strictly functional architecture. That makes the world a much better and more beautiful place...",topic_9,0.62306535,Positive
On let's not get lost in the matrix,topic_9,-0.04995837,Neutral
"for lack of a better term, but this has to be some sort of “record”, right? for a structure to go up and in the span of a couple years have this many incidents is insane.",topic_9,-0.65840906,Negative
I remember the renderings of the continued Highline and public spaces Related put out for that development earlier. They hired the landscape architect for Monticello and made it sound like it would be a parkland paradise. That failed to materialize.,topic_9,-0.13909245,Neutral
"When it came down to it, it was either to build a bunch of pointless stadiums to host the olympics or spur economic activity.",topic_9,-0.63514894,Negative
caring more for aesthetics than safety,topic_9,-0.48538107,Negative
"I think you're mistaking poor design and animosity over the developer next door as some sort of conspiracy ""to keep poors away"".",topic_9,-0.6858091,Negative
how is it at all a conspiracy? it was a deliberate design decision to make the complex look unappealing when viewed from 10th avenue.,topic_9,-0.63514894,Negative
"When an architect agitated for a more lavish cladding [for the facade along 10th Avenue], a Related executive waved him away. “Who’s going to see it?” he asked. For the developers, the towers gather round a central stage. The rest of the city is its back-of-house.",topic_9,-0.13909246,Neutral
"i mean obviously they can't physically bar people from public spaces. but they can (and have, and still make) design decisions to make access as difficult or unappealing as possible. i don't think that's a bombastic or conspiratorial take given the actual and proposed design of the complex",topic_9,-0.48538113,Negative
If they tore down townhouses in the village to build this complex I would sympathize more with the complaints. In fact I’d be outraged.,topic_9,-0.69625765,Negative
I obviously didn’t sway you but nothing you offered changed my mind a quark either. They practically built Atlanta on top of a train yard. It was never going to be flawless. And nobody could have (should have) expected otherwise.,topic_9,-0.6858091,Negative
There were proposals to build a football stadium on that site (instead of Metlife Stadium) for the Jets and Giants and it was also floated as a site for a new Yankee Stadium. According to the plans the batter would have been able to see the Empire State building from home plate. Both rejected for what we have now. Please mourn the dead but fuck the billionaire owners.,topic_9,-0.45421642,Negative
"""People keep throwing themselves off of it.""",topic_9,-0.5005202,Negative
"""Instead, a digital rendering of the structure will be sold as a non-fungible token (NFT) in an auction next month.""",topic_9,0.04995837,Neutral
"Also cost like 300m to build, pretty insane for what it is.",topic_9,-0.680476,Negative
I feel so bad for the structural engineer on that project.,topic_9,-0.7305939,Negative
Holy God. May I know the architect who designed this?,topic_9,0.4699452,Positive
Thomas Heatherwick,topic_9,0.07982977,Neutral
This was my first thought when I saw that building,topic_9,-0.17808087,Neutral
Yes it is. It's designed by Thomas Heatherwick. Have a look in his website. He's designed some amazing architecture.,topic_9,0.7487043,Positive
"He calls himself a designer, not architect",topic_9,-0.38847268,Negative
You sound like my old architecture theory prof—what’s your opinions on Gehry?,topic_9,-0.13909246,Neutral
They are currently looking for a permanent name for this structure.,topic_9,0.029991003,Neutral
Why did this get built? In all honesty. What goes on there?,topic_9,-0.66403675,Negative
"Does that include the land that it's built on? Because that area is currently being developed like crazy...I work in a restaurant near there, and the construction sounds are a nightmare.",topic_9,-0.6469295,Negative
"I mean, it's pretty big, and it's not like they were just building your standard warehouse or whatever that has been done a hundred million times already. There were probably a lot of design and engineering hurdles that they came across that they had to come up with novel solutions for.",topic_9,-0.13909243,Neutral
horrific monstrosity,topic_9,-0.7113938,Negative
Yeah it may be too far gone at this point unless they can somehow get it to be known for something else instead.,topic_9,-0.597982,Negative
If someone wants to build a monument that peopke can experience fun verticality than that should be allowed,topic_9,-0.019997345,Neutral
They fucked up the 2nd and 3rd and 4th time.,topic_9,-0.7305939,Negative
well and the fact that it is a grotesque manifestation of the worst that architecture and private financed art has to offer the world. that said yes I climbed it and had myself a nice selfie.,topic_9,-0.4462436,Negative
"My problem, highly summarized, is this kind of development tells us who deserves high end architecture and who doesn’t. It reinforces our idea of what architecture is even supposed to do.",topic_9,-0.65270674,Negative
"if we're building giant pieces of architecture solely for social media, we've truly lost our way as a society.",topic_9,-0.69625765,Negative
"Rich people and architects have been collaborating since the beginning of human history to build things that others will marvel at, want to capture in images, and just generally be associated with.",topic_9,0.46211717,Positive
"The pyramids exist because pharaohs wanted to build self-indulgent monuments to themselves. Same can be argued for picturesque castles and beautiful cathedrals, jockeying for influence and attention and power.",topic_9,-0.07982977,Neutral
"I think I would actually mix some shrubbery with the cityscape, on the other hand. Especially if it means building one of those eco-friendly building plans to suck up the excess CO² in the air and keeping what's left of our atmosphere from frying up.",topic_9,0.13909245,Neutral
Ideas:,topic_9,0.1586485,Neutral
"I can imagine a scenario where the original architect is blamed for not wanting to compromise the artistic vision or whatever. Seems like they're explicitly clarifying that is not the case, without totally throwing the developer under the bus (just yet, I guess) by using an off the record quote.",topic_9,-0.421899,Negative
Can't imagine that there will be anything but more heat on the developer now.,topic_9,-0.64692944,Negative
The Bobst library at NYU has a design like this. Terrifying for someone who has vertigo like myself.,topic_9,-0.67506987,Negative
I think it’s very sad what’s happened but it will continue to happen without some drastic change. I look forward to revisiting this area and I’d accept it without or severe design changes.,topic_9,-0.55112803,Negative
"Stay away from tall buildings, kid, before you get the urge to build a giant deconstructionist sculpture.",topic_9,-0.46211717,Negative
Beautiful structure bad energy in the design.,topic_9,0.55805224,Positive
Awful design...,topic_9,-0.71629786,Negative
Good. The building is haunted now.,topic_9,-0.59798205,Negative
"got downvoted for suggesting that the building is contaminated with evil, glad that the adults in charge are being sensible and doing what needs to be done.",topic_9,-0.56489956,Negative
that copy design on the website really bothers me. using periods and then the first letter is lowercase is certainly a choice.,topic_9,-0.71629786,Negative
"It's one of the most heinous buildings we've seen built in the last few years, and that's impressive considering the hall of shame flat glass stock being erected all over the city.",topic_9,-0.71629786,Negative
"Hardly the first, see Soylent Green.",topic_9,0.039978687,Neutral
electro coated steel,topic_9,0.099667996,Neutral
"I don't know. Some would say humans just find an appeal in building up, others would say it's a proxy for a metaphorical penis size competition",topic_9,-0.26362485,Negative
"Yep, it’s actually steel that’s just been treated to look the color of copper. So it won’t ever turn green.",topic_9,-0.4300842,Negative
"Go check out the American Copper Buildings, at 626 First Avenue! Real copper facade installed in 2015, which will turn green in the next few decades.",topic_9,0.66959023,Positive
So that's what that iconic green roof color is! I thought it was some sort of weatherproofing.,topic_9,0.3274774,Positive
"Yeah, they definitely did something to keep it copper like that.  It's been under construction for a long time and it would have started getting green months ago.  I wouldn't be surprised if it's not even real copper, but some kind of man made material.",topic_9,-0.17808086,Neutral
You could build a 150 unit condo tower for that price.,topic_9,-0.049958378,Neutral
Really? Where exactly will you be building then?,topic_9,-0.14888504,Neutral
There's just not enough room to organize a construction site to make it efficient.,topic_9,-0.63514894,Negative
"There's always more space - for example, by building over train yards...",topic_9,0.20696649,Neutral
It’s huge and complicated to fabricate and construct.,topic_9,-0.597982,Negative
I'm guessing the cost includes the park around the structure as well.,topic_9,0.03997868,Neutral
"Copper goes green, steel beams go rust",topic_9,0.01999733,Neutral
"Look, teams architects/ engineers and consultants designed and built this thing. It’s a major feature of the city, you fucking think they are going to use an old ass material like bronze or copper to clad this?",topic_9,-0.65270674,Negative
"Well shit, I thought this was the base and structure for a building",topic_9,-0.6169093,Negative
Honestly this whole time I just thought they were constructing a building reeeeally slowly.,topic_9,-0.24491866,Neutral
What is the point of this?,topic_9,-0.65270674,Negative
Okay? That's how the vast majority of great architecture is commissioned,topic_9,-0.01999733,Neutral
"Yeah, if it lasts long enough it could become a piece of history but I still think it lacks in the symbolic appeal that monuments like the Statue of Liberty and the Effiel tower have (the Effiel tower was made for the world's fair 100 years after the revolution). Regardless I'm excited to see it when it opens!",topic_9,0.46211717,Positive
"There are several theories about pollution, namely foreign contaminants introduced directly on to the surface of buildings such as this one.",topic_9,-0.41364443,Negative
Aesthetics and culture.,topic_9,0.10955847,Neutral
"Well, things take time, look at the GWB.",topic_9,0.039978683,Neutral
I have no idea why they built that except as a base for the Mighty Monarch!,topic_9,-0.6469295,Negative
Never heard of this til now...what is the point of it?  Just a set of many stairways and landings??? Seems like the architect lost his mind on this one....,topic_9,-0.6910695,Negative
This building was literally designed to be an Instagram trap.,topic_9,-0.7064193,Negative
Gimmick? Why so salty? It's a pretty cool piece of engineering,topic_9,-0.029991005,Neutral
Calling it one doesn't detract from the architectural or engineering creativity of the structure itself,topic_9,-0.01999733,Neutral
"Yeah but the architect was told before it built how it was dangerous and how to improve it and said that the improvements would harm the design. In fact he said, ""We don't want to design in fear"" So unless they really change it they won't.",topic_9,-0.66403675,Negative
lol yeah obviously i’m also referring to the design and appearance as well not just the fact it’s a suicide machine,topic_9,-0.4777,Negative
Is haunted,topic_9,-0.5079774,Negative
Reminds me of Architect's Leap at Carnegie Mellon University,topic_9,0.13909245,Neutral
I hope the designer notices before it's too late or it's really going to screw their vision.,topic_9,-0.7013741,Negative
"Ahh good for the workers yea, I actually work in one of the building currently up. I don't mind the construction, all the scaffolding gives me cover when it's raining out.",topic_9,0.6858091,Positive
"Architecture can be art, and not just pure function.",topic_9,0.19737533,Neutral
"What does ""waste of space"" mean exactly? Is the Grand Canyon a waste of space? Not defending this design, which looks dumb, but I'm always curious what people mean when they say that space has been ""wasted.""",topic_9,-0.62914515,Negative
"edit: oops, thought this was the Architecture sub redit, so was a bit technical.",topic_9,-0.30950692,Negative
"Yeah, I'm an architect.",topic_9,0.45421642,Positive
whats the point of this giant building if there are no rooms? do you just walk up and down,topic_9,-0.5915194,Negative
Probably a semipublic atrium for a highrise apartment building.,topic_9,0.009999668,Neutral
If MC Escher were an architect,topic_9,0.029991005,Neutral
"So sad after watching them build the think from sections floated and to the west side, then craned and driven to the site.",topic_9,-0.7013741,Negative
"Whatever you think of the structure, it was fascinating watching it being built day after day.",topic_9,0.73978305,Positive
"Like, what is this structure for? Looking cool? I'm genuinely asking",topic_9,0.41364443,Positive
I can’t wait till nobody uses it in 4 months.,topic_9,-0.64692944,Negative
London,topic_9,0.1877462,Neutral
"Well I say London because they’re from all over London. Inc, Brixton, Hampstead, Richmond, Twickenham, Hammersmith, Holland Park...",topic_9,0.16838104,Neutral
"It’s to show the masses that seemingly impossible engineering problems can be overcome, to wow the audience of the wonder of engineering, and to perhaps inspire younger people to take a career in the field.",topic_9,0.7064193,Positive
So it is done then? I was there a few months ago and thought it was the inside of a building being constructed before the outside - very cool,topic_9,0.73978305,Positive
That sounds pretty awesome but I can’t imagine. What caused it to be a nightmare to work on?,topic_9,0.109558456,Neutral
It was awful mostly because of the engineering. We had one guy working on it and every step of the way kept throwing out little nuggets like ‘I Hope this’ll work’ or ‘oh it’s gonna be a mess on site’. It was structural tube and angle with white powdercoated cladding that had to be welded after powder coat. Basically every step of the way it was shit.,topic_9,-0.7305939,Negative
Newspapers here are reporting that it was built in Italy and shipped.,topic_9,0.009999666,Neutral
Civil Engineer dream Engineer who had to make it safe nightmare Construction workers death,topic_9,-0.32747737,Negative
Nah. Architect's dream. CivE's nightmare.,topic_9,-0.30950692,Negative
The challenges they had/have to overcome building over a train yard would be fascinating to learn more about. I would interested talking to him about that if he was involved in that at all,topic_9,0.46994525,Positive
"I saw this being built and thought it was like 10% complete... turns out it was 80% complete! Lol, art baby",topic_9,0.71629786,Positive
"It is an impressive, beautiful structure.  It is a marvel of architecture and engineering.",topic_9,0.7487043,Positive
I'm comparing it to other building in NYC. Jumping off a structure endangers people on the ground.,topic_9,-0.57167,Negative
I'm not sure what they were thinking designing this thing.,topic_9,-0.66959023,Negative
"Funny, it’s the nypost that makes me want to jump from tall buildings, not ugly architecture.",topic_9,-0.5298956,Negative
Teamwork makes the dream work!,topic_9,0.7305939,Positive
Now look up sovereign immunity.,topic_9,-0.12927258,Neutral
My point is that this sets no precedent. The laws and concepts exist.,topic_9,-0.1586485,Neutral
"I dunno, I enjoyed the architecture.",topic_9,0.6106769,Positive
I think I see my dad,topic_9,0.23549576,Neutral
"It's a character descriptor at this point, akin to ""sleazeball"", ""asshole"", or ""moron"".",topic_9,-0.6858091,Negative
The developer and architect had a chance to make changes and they didn’t want to mess with the aesthetics. Now they would rather close? It’s better raze it than let it sit there like a tomb.,topic_9,-0.64692944,Negative
I’m not talking about 4th floor walkups… Do you think a 4 story building is a skyscraper?,topic_9,-0.1194273,Neutral
They really should evaluate the Oculus also. It’s just too fucking easy for some kid to do something stupid or someone in distress to think too quickly. How this shit happens in the most heavily used modern architecture blows my mind.,topic_9,-0.73978305,Negative
Wow. That is a beautiful and innovative sculpture.,topic_9,0.73978305,Positive
"True that. Grain of sand in the desert of man, and all. The protective dune doesn’t build itself.",topic_9,-0.37994897,Negative
"Saw a pretty incredible exhibition on their work at the Cooper-Hewitt last year, made me appreciate their design choices a lot more.",topic_9,0.7530659,Positive
I'm not offended i just think its a shitty design. It isolates groups. Better architects find ways to include them.,topic_9,-0.7113937,Negative
"This is all its for, though. Taking pictures from. It's godawful architecture",topic_9,-0.69625765,Negative
I doubt it. This is a pretty new construction project. I think that this phase of construction has only recently been completed.,topic_9,-0.27290508,Negative
Has anyone ever felt a weird feeling on that building? I could not think straight on it. Then I had a friend tell me that they  had a possessive feeling on the building as well.,topic_9,-0.5441271,Negative
"Ever travel cross country and you'd see a billion billboards for some crappy poorly thought-out tourist trap like ""the world's largest peach stand!"" and you go there and you realize that it's just an underwhelming gas station with a giant peach-shaped structure behind it made of plywood?",topic_9,-0.58497983,Negative
Dad? What's that building?,topic_9,0.029991005,Neutral
I can’t help but respect it from a design/aesthetics POV though.,topic_9,0.66403675,Positive
In fact let's put the building up in front of it faster,topic_9,0.069885895,Neutral
I met the inventor of a vase that was shaped just like this. Cool.,topic_9,0.7113937,Positive
I dont understand how this thing costs $200M to build.  The thing is less than 10 floors high.  That means it costs $20M per floor for concrete and steel and a few electrical wires.  Even if all the steps were escalators id still think it's overpriced.  Are they factoring the land costs and air costs into the $200M?  Because in just raw materials and labor the this half-ass not even a whole building should be $10M-20M at most.,topic_9,-0.6858091,Negative
In China they could probably build this for $1M dollars.,topic_9,0.01999733,Neutral
Oh boo hoo. Maybe they should have designed something that doesnt make people want to throw themselves off it.,topic_9,-0.65270674,Negative
That’s like saying whoever designed the World Trade Center shouldn’t have built a building that made people want to fly planes into it.,topic_9,-0.55805224,Negative
Designed by the Devil himself.,topic_9,-0.6106769,Negative
"Like said previously, The Highline. A total reuse of an existing feature to turn it into an extention of public land. It has a focus on greenscape and the overall showcase of architecture on and around it is really cool.",topic_9,0.7352223,Positive
"ETA: not that anyone asked me but yeah, it’s a stupid looking and dangerous vanity project that should be scraped.",topic_9,-0.72589743,Negative
I think this is truly the dumbest building in NYC,topic_9,-0.72589743,Negative
Just a disgusting building,topic_9,-0.7211323,Negative
First glance I thought this was someone's build on Satisfactory.,topic_9,-0.099667996,Neutral
I thought this was a build on Minecraft,topic_9,0.049958374,Neutral
Maybe ivy. It is definitely impressive up close.,topic_9,0.72589743,Positive
"Yeah, lets go with ""a botanical addition""",topic_9,0.099667996,Neutral
"Yeah, but what's the architect gonna say about that? What if we instead invested the money on educating healthy lifestyles in school or something",topic_9,-0.492988,Negative
The architect probably won’t give a shit since the structure is already built and it’s ultimately up to the owner anyway.,topic_9,-0.66403675,Negative
That’s an art project as much as a business dealing. Do you think an author would mind if their publisher rewrote the plot of their book after signing a contract? I do. The architect probably cares very much how it’s presented and what changes are made. Particularly since it’s a famous structure which they can include in their portfolio.,topic_9,0.06988588,Neutral
"They would just go elsewhere, won't they? I don't see how the architect is to blame here, instead of spending money/energy on suicide proof buildings, those funds should go towards mental support etc.",topic_9,-0.65270674,Negative
"Yeah an architect may not like it but with as much respect I have for artist, people's lives are more important. If I made something and someone else modified it to make it safer, I know I'd understand and I'm going to question anyone who wouldn't.",topic_9,-0.19737531,Neutral
Does the architect have a say in it anymore?  It has been open for a while.,topic_9,-0.049958374,Neutral
"The architect (Heatherwick) actually designed higher barriers for this purpose, but the developer refused to put them in.",topic_9,-0.4381993,Negative
"Beautiful, unrelenting capitalism. Unashamedly predictable.",topic_9,0.62914515,Positive
"Great idea, you should let Steven Ross know.",topic_9,0.7487043,Positive
"He said he didn't tell her, but he thought about it properly himself.",topic_9,0.0,Neutral
"This may be slightly random, but the architect (Thomas Heatherwick) is also a designer of a building in Singapore called Hive. It’s a beautiful building in the center of a university, but it is also a known suicide sire.",topic_9,0.1877462,Neutral
The architectural part feels very unique as well. Once you get inside and start climbing you realize you have never been in a structure like it before. That part does feel surreal.,topic_9,0.72589743,Positive
"Let's be real, that building is not a nice thing to begin with.",topic_9,-0.7113937,Negative
"The building has proven itself to be a failure. The architecture, the circumstances, it has all come together to be a blight on NYC. That in itself is an indicator that whatever was hoped for, hasn't worked out. Unless the goal was suicides and jokes about it being a death tower was the goal? Otherwise we can unequivocally say, this project was not a success.",topic_9,-0.7305939,Negative
"I am not a fan of the design after living near it for a couple years,, but I don't necessarily blame the architecture. If a human wants to climb over a fence or wall to jump they will. The hanging garden idea in the comments is interesting as it could integrate the design at a human scale and provide safety. However as a architectural designer I hate the argument 'just raise th fences' because they did and surprise someone found a way over, they even have a rule you can't go to this by yourself ( which is another bag of worms ).",topic_9,-0.6043678,Negative
The building give me Dead Space vibes.,topic_9,-0.18774621,Neutral
The building is clearly the issue here,topic_9,-0.5005202,Negative
Really hope this was useful and relevant :D,topic_9,0.7530659,Positive
"That's a shame, not just because of the dead people, but also because that's a really cool looking building.",topic_9,-0.6910695,Negative
Not a building.,topic_9,-0.10955848,Neutral
Wait what’s the point in that building?,topic_9,-0.6043678,Negative
"This building doesn't look in my opinion evil in the slightest, and the backstory doesn't change how it looks. This is just my opinion though looks like something out of those utopian depictions of a futuristic city with modern architecture.",topic_9,-0.5441271,Negative
"So, what's the point of the structure, get some steps in? I was hoping it transformed. It looks pretty cool.",topic_9,0.59798205,Positive
"Such pointless building, pure vanity.",topic_9,-0.7211323,Negative
"EDIT: Reply below me is most probably correct, most Egyptologists conclude that the pyramids were built by ordinary workers who couldn't work other jobs like the fields during times of flooding.",topic_9,-0.1194273,Neutral
I thought I read that they discovered that the pyramids were built by paid construction crews and not slaves. I'm too lazy to look it up though.,topic_9,-0.19737531,Neutral
"All that was installed well after it was planned and built. Its sole concept is to be a 300m-high tower, with no purpose other than showing man can build it.",topic_9,-0.43819928,Negative
What a dumb structure anyway,topic_9,-0.7013741,Negative
"Wow , what a pointless building.",topic_9,-0.7305939,Negative
Designed by Ivo Shandor,topic_9,0.019997336,Neutral
Thats beautiful architecture,topic_9,0.7352223,Positive
"This reminds me of the building in I, Robot - weirdly, that kicks off with a deadly fall as well.",topic_9,-0.597982,Negative
I thought it was built as a set for that famous chainsmokers song,topic_9,0.0599281,Neutral
Today I learned there’s a sun called evil buildings,topic_9,-0.5849799,Negative
Looks like the type of structure you can take good photos of but then when you get up it; it's underwhelming.,topic_9,-0.66403675,Negative
"Weird, ive had nightmares abt being stuck on a building like this an d ive never seen it",topic_9,-0.6469295,Negative
What's the point of that anyway?,topic_9,-0.64692944,Negative
