Document,Topic,roberta_polarity,roberta_sentiment
It must remain. Things happened there that have occurred for decades on too many bridges or skyscrapers.,topic_12,-0.46211714,Negative
-The Darkside has entered the chat-,topic_12,0.03997868,Neutral
And do you know how many people jump off the GWB or Brooklyn bridge? Factually a lot more. Where's the outrage? Where's the clamoring to make those bridges suicide proof? That's what I thought...,topic_12,-0.66403675,Negative
Where's the clamoring to make those bridges suicide proof? That's what I thought...,topic_12,-0.5005202,Negative
bridges ranging from barriers to signs with helplines.,topic_12,-0.03997868,Neutral
Bridges are vital pieces infrastructure. A cool looking art installation isn't.,topic_12,-0.2821348,Negative
Where's the clamoring to make those bridges suicide proof? That's what I thought...,topic_12,-0.5005202,Negative
"Bridges have a clear purpose (transportation) that vastly overshadows the public perception of suicides; the Vessel has no similar ""purpose"". That's why it's not in the news as much, not because of virtue signaling.",topic_12,-0.5298956,Negative
I get how blocking off bridges and gun/pesticide control would work- without a bridge a ordinarily a person would have to go out of their way to find another high platform to jump from.,topic_12,-0.26362485,Negative
The Golden Gate Bridge or Hoover Dam?,topic_12,0.03997868,Neutral
Or how about the 12 story project in Detroit?  The George Washington Bridge?  The railroad behind the factory?  The carbon monoxide filled garage in anyone's home?,topic_12,-0.492988,Negative
Agreed. they arent closing down the Golden Gate Bridge. But 4 people in 2 years is a ridiculously huge number. I think part of this is that A. its is a very high profile landmark and for whatever reason suicides a more prevalent at them and B. we are in dark times and this landmark opened right when they started.,topic_12,-0.6043678,Negative
"How does the suicide rate at the Vessel compare to the rate at the Brooklyn Bridge, George Washington Bridge, Empire State Building, in front of subway trains, etc?",topic_12,-0.19737533,Neutral
"The Brooklyn Bridge and Empire State Building, at least, have significant barriers to jumping.",topic_12,-0.5153593,Negative
"That's it, get rid of it all! /s",topic_12,-0.65840906,Negative
Add the VZ Bridge to that list.  It's been a place for the last dozen or so years.,topic_12,0.0,Neutral
Hire a bunch of golden retrievers to run around trying to get visitors to play with them.,topic_12,-0.0099996645,Neutral
You had me at bunch of golden retrievers,topic_12,0.30950692,Positive
"""If you do not remedy this malparkage in 72 hours, your car will be dumped into the East River at your expense.""",topic_12,-0.7211323,Negative
"Yep. Apartment balconies, shopping malls, cellphone towers, subway tracks, Queens Blvd, Long Island expressway, Brooklyn Bridge, the Hudson River...plenty of places for people to off themselves of they're determined to do so. At some point we have to realize we cant shut everything down due to the potential for these types of incidents.",topic_12,-0.25429553,Negative
"Only four people have survived a suicide jump from the Golden Gate Bridge. One would hit the water at well over 120mph leaving one almost incapable of handling the freezing waters. All four were left seriously injured for life, regretted doing it and never tried again.",topic_12,-0.7064193,Negative
So close all the bridges in the world,topic_12,-0.4462436,Negative
Dam 🦫,topic_12,-0.4053213,Negative
Brooklyn Bridge has entered the chat room…..,topic_12,0.009999668,Neutral
(Sandy was 2012),topic_12,0.08975778,Neutral
"Manhattan Bridge? Pretty sure that's painted blue, my man.",topic_12,-0.12927258,Neutral
When I was typing that I was recalling this “color influence diagram” that Shop Architects presented for their 247 Cherry St Tower (the Two Bridges Project) which they are going to clad in a green hue terra-cotta. They listed the bridge as one of their influences.,topic_12,0.059928104,Neutral
More people have died jumping from the Golden Gate Bridge. Do you look at that and think “evil”?,topic_12,-0.72589743,Negative
"It is far less than the GW Bridge,  Verrazano and old Tappan Zee Bridge. So I'm not sure what you're comparing it to.",topic_12,-0.39693043,Negative
You should tell your theory to the MTA. I hear they have some train platforms without guardrails… also the TBA has a bridge or two that might need a bubble around it.,topic_12,-0.23549576,Neutral
There's no point in installing seatbelts in cars. People will crash their cars anyway.,topic_12,-0.66959023,Negative
"Anything tall, man. Golden Gate Bridge sees an average of 30 suicides per year.",topic_12,-0.5298956,Negative
"I liked doing it because it was convenient, close to the train line and I got to see the Brooklyn Bridge everyday.",topic_12,0.7442769,Positive
Most bridges also have such devices in place.,topic_12,0.0,Neutral
"Bridges are also important and useful, and if you closed the GWB or Brooklyn Bridge, even partially, there would be a political firestorm.",topic_12,-0.26362485,Negative
"For the bridges, you'd only have to close it to pedestrians, though.",topic_12,0.009999668,Neutral
"To echo this, many survivors who attempted suicide at the golden gate bridge regretted their choice halfway down and realized their problems were treatable after that.",topic_12,-0.49298793,Negative
1978 study on Golden Gate Bridge survivors ,topic_12,-0.03997868,Neutral
The 1978 Seiden study at the Golden Gate Bridge showed that 90 percent of those stopped from jumping did not later die by suicide or other violent means.,topic_12,0.04995837,Neutral
"If you are open to further challenging your perspective and learning more about suicide attempts and survivals at the Golden Gate, I would definitely recommend checking out the documentary Jumpers. I think it may be on YouTube.",topic_12,0.5005202,Positive
"The vessel didn’t put up nets like the Golden Gate Bridge, as the company determined that it would spoil the aesthetic. They falsely came to the conclusion that having suicide watchers, banning single tickets, and bit higher railing would be enough. The corporate machine adds yet another death to their tally.",topic_12,-0.67506987,Negative
"Exactly, why get rid of a structure because people jump off of it…like what are we going to do next? Ban all bridges?",topic_12,-0.66403675,Negative
Does the Vessel provide the same service as a bridge?,topic_12,0.029991005,Neutral
There was a major public study done here in CA on suicide fences on Cal Trans bridges it was such a problem.,topic_12,-0.66959023,Negative
Good points. The golden gate has managed it pretty well doing patrols. I remember reading numbers were way way down but you are right. Different settings probably attract different depressed \ troubled demographics.,topic_12,0.4300842,Positive
https://slate.com/technology/2013/10/golden-gate-bridge-suicide-barrier-controversy-and-cost-over-a-life-saver.html,topic_12,-0.21651806,Neutral
Golden gate managed it pretty well having walkers patrol the bridge. Its deaths and attempts are way way down. Probably the way to go honestly.,topic_12,0.55112803,Positive
"Idk, this is like that pedestrian bridge in Scotland that dogs kept hurtling themselves off of, plunging to their deaths.",topic_12,-0.7113937,Negative
Overtoun Bridge,topic_12,0.019997334,Neutral
And *international news to boot,topic_12,-0.34521404,Negative
"More realistically, like ""Oh no,  the door to the balcony is locked!"" or ""Curses! There's some protesters on the bridge!"". Small stuff that directly interferes with the act itself is shown to stop you altogether from doing it.",topic_12,-0.64692944,Negative
"Is the Korean rate going up because of the bridge? Suicide in Japan and Korea is pretty high I think, but I don’t think bridges are causing it.",topic_12,-0.5849799,Negative
This sounds like it’d be the logical position but studies on locations like bridges show it’s actually not correct in the real world. The Golden Gate Bridge is a great example.,topic_12,-0.62306535,Negative
I guess we should close all train stations and large bridges too? This is lame. That is a really nice piece of art and architecture.,topic_12,-0.7113937,Negative
I live beside a suicide magnet in Toronto; the prince edward viaduct. After reducing the suicide numbers with a barrier the bridge is a lot more safer. Something like that needs to happen here and can even improve the look of this structure if done properly.,topic_12,0.25429556,Positive
"Oh, great.  Better shut down the Golden Gate Bridge, then.  Or figure out a better solution.",topic_12,-0.6469295,Negative
Yeah I’m not sold on this as an ‘iconic monument’ yet,topic_12,-0.55805224,Negative
"1700 people have flung themselves off the Golden Gate Bridge, but not one person has suggested shutting the bridge down.",topic_12,-0.597982,Negative
Have you seen the documentary where they actually film people jumping off the bridge?  They just disappear into the fog and that’s it. Very sad and moving.,topic_12,-0.6858091,Negative
The Bridge,topic_12,0.13909245,Neutral
Edit: ^ like in the case of the filming of the Golden Gate Bridge suicides (but actually— did the filmmakers try to intervene first??),topic_12,-0.07982977,Neutral
Can’t imagine how much that cost! The bridge is huge. It’s worth it though if lives will be saved.,topic_12,-0.22602834,Neutral
"The Golden Gate Bridge serves as a utility (ie getting from one place to another), whereas this structure does not serve any purpose. And interestingly enough, the Golden Gate Bridge has been adding suicide nets to prevent people from dying. They’re likely to do the same thing here, or create taller barriers.",topic_12,-0.46211714,Negative
Obviously the suggestion is to close the pedestrian walkway on the bridge (which is basically only used by tourists) not close the entire bridge to everyone.,topic_12,-0.16838105,Neutral
Which is the name of de documentary?,topic_12,0.019997334,Neutral
I’d imagine there aren’t a bunch of tourists milling around under the Golden Gate Bridge.,topic_12,-0.059928097,Neutral
People drive their cars into bridge pillars everyday.  Should we get rid of all cars because of what a few people might do with them?,topic_12,-0.641077,Negative
The Golden Gate Bridge is also in the process of constructing a suicide net below each side of the bridge’s railing.,topic_12,-0.1194273,Neutral
That bridge serves a purpose to the city for transportation. And it’s an iconic historic landmark. These stairs are an overpriced architectural statement piece that lack necessity.,topic_12,0.1586485,Neutral
Granted that bridge is alot more important for and detrimental to the cities function.,topic_12,-0.36270747,Negative
This New Yorker piece on the Golden Gate bridge is heartbreaking:,topic_12,-0.7113937,Negative
"The only reason I didn't get closer to it is that there was one lone person also on rhe bridge and I was afraid he would see. I made it across the bridge and ever since I've wondered how often those signs save, and how often they trigger it",topic_12,-0.31852078,Negative
There was a documentary years ago about people who jumped off the Golden Gate Bridge and I was surprised how many people traveled from quite far away to kill themselves there.,topic_12,-0.62914515,Negative
Great documentary too.,topic_12,0.7442769,Positive
Maybe in The City and London Bridge. But go to Canary Wharf or the massive new development in Nine Elms/Vauxhall and the tall buildings there are dull and generic,topic_12,-0.33637553,Negative
"Bay area, not the Golden gate.",topic_12,-0.059928104,Neutral
No bike lanes????,topic_12,-0.3004371,Negative
More than 25 from the Brooklyn Bridge; no one is talking about shutting that down.,topic_12,-0.4300842,Negative
A similar thing happened in toronto when they put a net over the prince Edward viaduct.,topic_12,-0.19737533,Neutral
"The viaduct is a very tall bridge right on the subway line near down town.  It has a very low guard rail.  Because it was high,  easy to get to, easy to jump off it was a very popular with people wishing to jump.  The city put a net up so they can no longer jump.  While suicides on a bridge stoped, the suicide rate in the city stayed the same.",topic_12,-0.01999733,Neutral
trust me    i live not too far from the second most suicidal bridge in north american after the famous golden gate !,topic_12,0.35399172,Positive
Bridges and factories in China,topic_12,-0.1877462,Neutral
Suicide nets like the San Francisco bridge,topic_12,-0.67506987,Negative
"There's a documentary about people jumping from the Golden Gate called ""The Bridge"" where a researcher filmed The Bridge from a distance with a fixed camera for a year and caught numerous suicides on camera.",topic_12,-0.4053213,Negative
Quotes from two Golden Gate Bridge suicide attempt survivors:,topic_12,-0.059928104,Neutral
https://abc7news.com/golden-gate-bridge-suicides-suicide-survivors-jump-survive/2010562/,topic_12,-0.23549576,Neutral
Research on Golden Gate Bridge suicide attempt survivors found 90% did not die later by suicide. Those are good odds.,topic_12,0.59798205,Positive
"Of the 515 people whose attempt was interrupted, only 35 later died by suicide in the years to come.  Taking into account suicides that might have been missed by researchers,  Dr. Seiden stated that 90% of people who tried to jump off the Golden Gate Bridge did not go on to die by suicide.",topic_12,-0.41364443,Negative
They jump off the skyway bridge all the time,topic_12,-0.01999733,Neutral
Here is an interview with a Golden Gate Bridge suicide attempt survivor,topic_12,-0.10955847,Neutral
https://www.wect.com/2020/11/17/it-was-instant-regret-golden-gate-bridge-suicide-survivor-share-story-virtual-event-wilmington/,topic_12,-0.21651806,Neutral
"Yup. That has saved me a few times. Not even exaggerating, I had picked the bridge and chosen a date, then I got to that episode and couldn’t go through with it.",topic_12,0.13909245,Neutral
"Yes, I watched a video about a guy who survived jumping from the golden gate bridge. Even though he'd been depressed since forever, he said that the split second he left the bridge he knew it was a huge mistake.",topic_12,-0.16838104,Neutral
You ever have the urge to just chuck your phone off a bridge?,topic_12,-0.54412705,Negative
Closing a staircase over 4 suicides in 2 years is pretty extreme. Based on that logic we ought to shut down the Golden Gate Bridge or the Brooklyn Bridge as well.,topic_12,-0.6858091,Negative
I don't know if that's a fair comparison since the bridges serve an actual function whereas The Vessel is more or less an art installation.,topic_12,-0.36270747,Negative
Then someone will just drive onto the bridge and get out of their car. All of this shit is just bandaid fixed that don't address the actual problem,topic_12,-0.7064193,Negative
Hey the Bloor viaduct is featured on that article! I've killed myself on that bridge dozens of times.,topic_12,-0.69625765,Negative
"I'm guessing since it's a crowded area and their bodies land on the floor where everyone can see, it's a bigger deal than people committing suicide on something like the Golden Gate bridge where it's not as visible.",topic_12,-0.46211714,Negative
"4 suicides in 2 years, not months. For context, the Golden Gate Bridge would have averaged 60 suicides in that time.",topic_12,-0.597982,Negative
Have you heard of the Golden Gate Bridge? I've personally witnessed it twice. Once from the bike path on the other side of the roadway (I saw him splash when I looked over my edge. He did not float again.) The other time standing on the shore looking at pelicans. This time the coast guard boat came out after about 15 minutes and started looking for him.,topic_12,-0.079829775,Neutral
This thing is not as high as the bridge but concrete is harder than water.,topic_12,-0.59798205,Negative
Super controversial documentary called The Bridge is about this.,topic_12,-0.009999672,Neutral
"you cant casually stroll down a lot of bridges, its awkward getting to the edge, cant take a cab right up to it. stuff like that. just a guess. Like harder to get to, people are too lazy to actually do it.",topic_12,-0.67506987,Negative
Damn I guess we shouldn't have built the golden gate bridge then,topic_12,-0.7013741,Negative
but they added barriers to the 2 most used bridges and suicides dropped overall by 30%.,topic_12,-0.7013741,Negative
Can’t close Verrazano bridge.,topic_12,-0.3274774,Negative
https://www.libertybridge.org/,topic_12,0.059928104,Neutral
https://jerseydigs.com/the-highline-has-nothing-on-jersey-citys-new-pedestrian-bridge/,topic_12,-0.049958378,Neutral
"That’s an expensive ass bridge when the PATH or the ferry are options to get across without using a car. Am I totally against the bridge? No, but it’s quite an expensive investment for what would essentially be a third option (or fourth, I think you can bike through the tunnels).",topic_12,-0.67506987,Negative
"Drivers should support these projects as well, as they reduce traffic by removing vehicles from the road more than any street widening could add capacity.",topic_12,0.37994897,Positive
That would be the best location for the bridge,topic_12,0.71629786,Positive
"It would be twice the distance of the other bridges (manhattan, brooklyn or williamsburg bridge) without the actual car traffic, and just for walking around for tourist. Negligible amount of people are going to use it to commute.",topic_12,-0.14888503,Neutral
"A Google search says 120,000 cars cross the Brooklyn bridge per day. That means pedestrians and bicyclists make up around 5% of bridge users.",topic_12,0.049958378,Neutral
So? You only want to build a bridge if it also accommodates car traffic? AFAIK it's not feasible to put a car path there. It greatly increases and complicates the footprint of the bridge.  The layout of the neighborhoods won't accommodate it.,topic_12,-0.66403675,Negative
I was arguing against the unsupported statement that no one  would use the bridge. Saying that the Brooklyn bridge facilitates more cars than people is besides the point.,topic_12,-0.48538113,Negative
I mean the bridge has six lanes for traffic and one 10ft ish span for pedestrians and bikes so it's not surprising that car traffic is like an order of magnitude greater. I'd guess that if the bridge has more space for pedestrians / bikes (and those spaces we're separated) use would increase. Particularly for bikes.,topic_12,0.04995837,Neutral
The Golden Gate Bridge laughs.,topic_12,0.45421642,Positive
"well yeah, it's more accessible than a bridge. It's also a beautiful art installation. I hope this doesn't cause it to get shut down permanently.",topic_12,0.62306535,Positive
"I was thinking of The Golden Gate Bridge, now I'm on the fence",topic_12,-0.17808087,Neutral
They have at least one emergency call box on San Francisco's Golden Gate - mb install a few here?,topic_12,0.029991003,Neutral
"Master/slave is a model of asymmetric communication or control where one device or process controls one or more other devices or processes and serves as their communication hub. In some systems, a master is selected from a group of eligible devices, with the other devices acting in the role of slaves.",topic_12,-0.019997334,Neutral
The Golden Gate Bridge is not impressed.,topic_12,-0.69625765,Negative
"They are repeating the mistakes of the Golden Gate Bridge directors, who for many years refused to construct a suicide barrier because it would ruin the appearance of the structure.",topic_12,-0.6858091,Negative
"Yikes, bro, have some compassion. You really hate people that are suffering because they ‘ruined a bridge’ or whatever??",topic_12,-0.73978305,Negative
Is that in Japan?,topic_12,0.009999666,Neutral
is it japan?,topic_12,0.009999668,Neutral
Stupid. Close every bridge then.,topic_12,-0.6910695,Negative
https://en.wikipedia.org/wiki/Cloud_Gate,topic_12,0.019997336,Neutral
There’s that guy that asks people how they’re doing at Golden Gate Bridge. Mabye a Walmart Greeter.,topic_12,-0.10955847,Neutral
"I mean ultimately people are going to do what they’re going to do. I live by a bridge and when I wake up and see search copters I know that someone jumped. People still do it, but they have phones there for crisis lines.",topic_12,-0.35399172,Negative
"Places like the Nanjin Yangtze River Bridge, The Golden Gate bridge, Aokigahara forest, and the Prince Edward Viaduct are notorious for their suicides, and as such, are actually sometimes planned destinations for people planning on ending it. As a New Yorker, I'm okay with this being shutdown indefinitely, especially if it's inaccessibility saves even one life.",topic_12,-0.55805224,Negative
https://www.npr.org/templates/story/story.php?storyId=92319314,topic_12,0.029991,Neutral
"Do we close the Golden Gate Bridge too? Many more people have jumped there. No. Do we ban the sale of guns, no.",topic_12,-0.597982,Negative
"I mean in all fairness for that bridge thing, those actually serve a purpose getting people from point a to b. Art of course has a purpose too but with little to no safety precautions a design like this was just asking for it in today’s society.",topic_12,-0.25429556,Negative
"Well, the Golden Gate Bridge has other purposes, you see. And a lot of people are upset that we haven’t done anything to curb gun violence.",topic_12,-0.680476,Negative
"You're right that if someone really wants to kill themselves and plans it out it's hard to stop them. But the sculpture thing does basically nothing to stop it - the railing is too short to stop anyone from climbing over it, which is not the case at the Golden Gate Bridge or most other destination suicide hotspots.",topic_12,-0.6106769,Negative
There’s an interesting counter argument with the Golden Gate Bridge safety nets that were just installed. The main argument that people had for the nets was that many people who jumped and survived didn’t attempt suicide again. Many saw the bridge as the only place they’d want to commit suicide too.,topic_12,-0.36270747,Negative
http://depts.washington.edu/psychres/wordpress/wp-content/uploads/2017/07/100-Papers-in-Clinical-Psychiatry-Suicide-Suicide-survivors.-A-follow-up-study-of-persons-who-survived-jumping-from-the-Golden-Gate-and-San-Francisco-Oakland-Bay-Bridges.pdf,topic_12,-0.08975778,Neutral
"If someone jumps from the bridge during the day, others can see. There is a documentary called ""The Bridge""  about some of the people who have jumped. There is at least one interview with a person who was driving by just as a person jumped.",topic_12,-0.0099996645,Neutral
The Golden Gate Bridge suicide nets are almost complete...,topic_12,-0.65840906,Negative
https://www.police1.com/suicide/san-francisco-installs-nets-to-stop-suicides-off-golden-gate-bridge,topic_12,-0.48538113,Negative
"Those jumping off the Golden Gate bridge are unlikely to land on anyone, but from this sculpture the risk must be much higher",topic_12,-0.4462436,Negative
"i would bet that the golden gate bridge has some kind of net or fence system for this exact reason, and probably has for a long time.",topic_12,-0.10955847,Neutral
More people have committed suicide at the Golden Gate Bridge than any other location. over 1400 people by 2012. It is certainly a problem. I am sorry you have so little empathy.,topic_12,-0.7352223,Negative
https://en.wikipedia.org/wiki/Suicides_at_the_Golden_Gate_Bridge,topic_12,-0.39693046,Negative
Measures have been taken at the bridge and measures were taken at this structure as well. This is just virtue signaling policy; in reality it does nothing to prevent suicide.,topic_12,-0.62306535,Negative
Didn’t they just install massive wire nets on the Golden Gate Bridge? I heard they’re working too.,topic_12,-0.029991005,Neutral
Funny just heard a story on NPR that they just spent $200million on a net for the Golden Gate Bridge to stop people from dying when they jumped.,topic_12,-0.25429553,Negative
The GG bridge has a (relatively new) suicide prevention net.,topic_12,0.24491866,Neutral
"In HS and freshman year of undergrad, I became obsessed with the Golden Gate Bridge as a place to yeet myself off of. Researched the hell out of it. Learned that there is a volunteer org dedicated to identifying potential “jumpers” in addition to a perpetual police presence.",topic_12,0.21651804,Neutral
The Golden Gate has been working on installing a metal net to catch would-be jumpers and just about every city/state will have their own “hot spot(s)” where people will attempt to end their life from.,topic_12,-0.46994525,Negative
"The bridge is such a shitty way to go. A bunch of your bones break and you drown, flailing frantically in ice cold water with your broken limbs.",topic_12,-0.73978305,Negative
http://depts.washington.edu/psychres/wordpress/wp-content/uploads/2017/07/100-Papers-in-Clinical-Psychiatry-Suicide-Suicide-survivors.-A-follow-up-study-of-persons-who-survived-jumping-from-the-Golden-Gate-and-San-Francisco-Oakland-Bay-Bridges.pdf,topic_12,-0.08975778,Neutral
That was always my worry going under the bridge. Thankfully never experienced anything like that on our transits.,topic_12,-0.52266544,Negative
"Because the Golden Gate bridge is iconic and is used by thousands of people every day to walk and ride bikes across, whether it be for work or just fun. It's an incredible experience walking across it. It's a loooooong way down. People who jump really want to die.",topic_12,0.72589743,Positive
"Check out the documentary ""The Bridge"" if you haven't already. Very sad but morbidly fascinating.",topic_12,-0.019997345,Neutral
