Document,Topic,roberta_polarity,roberta_sentiment
Also imagine building a structure like that and planting no trees or shrubs like wtf,topic_9,-0.680476,Negative
To be fair it looks really tempting. Look at that architecture.,topic_9,0.71629786,Positive
I’ve definitely had nightmares about this exact building,topic_9,-0.6469295,Negative
Beautiful place to do it,topic_9,0.7442769,Positive
No offence but god what an ugly building,topic_9,-0.7211323,Negative
Oh we're talking EVIL evil buildings now,topic_9,-0.66959023,Negative
It's interesting how they managed to perfectly materialize the feeling of oppression with a building.,topic_9,0.26362485,Positive
"The construction of the site itself is very interesting. It's basically all a bridge with a train yard below, the land above had to be constructed in addition to buildings. The skyscrapers can't use regular foundations because of that train yard, instead they're supported by hundreds of strategically placed tubes which were positioned between the tracks, drilled down to bedrock and filled with concrete. Huge steel girders sit on top of that to form the platform to build everything else on.",topic_9,0.5005202,Positive
"The Shed's architecture, it's designed to roll open and closed on train tracks, so it's built to be light weight. To do this, they built a steel frame and covered it in a form of Teflon instead of glass to save weight.",topic_9,0.06988589,Neutral
Wasn't it Bloomberg's idea?,topic_9,0.0,Neutral
Make it very “succession” among the skyscrapers,topic_9,0.3713602,Positive
I agree with the guy who hates Blank Street—the construction is what’s interesting. It’s a neighborhood built on top of a train depot.,topic_9,-0.38847268,Negative
"There's an outpost of Kossar's, the legendary bialy bakery. And I think Russ & Daughters is opening a new location there (to complement their LES locations and their shop/bakery and appetizing prep kitchen at the Navy Yard). Both stores have legendary histories they're building on at HY.",topic_9,0.55805224,Positive
"Look at old maps online with the old neighborhood zip codes, street names, etcetera, and then look for newspaper articles with information. When I was a flight attendant, sometimes we would be asked about specific areas, and that is what I would do in order to come up with some fresh views for my passengers.",topic_9,0.03997868,Neutral
I was a rebar and weld inspector for 2 of the towers there from its inception. So the construction sites were a marvel to witness!..... the end product has a lot left to be desired.,topic_9,0.7352223,Positive
It’s cool for photography and if you’re interesting in architecture. It also kind of feels a bit like walking into how I imagined future “big cities” to look when I was a kid.,topic_9,0.67506987,Positive
Never thought of this before and damn would that be sick if they added natural colors to that sterile white in the form of gardening it somehow,topic_9,-0.66959023,Negative
"Yeah, it's close to the ferry. Take that ride to Edgewater around sunset and it's just gorgeous, one of the most beautiful sights in the city.",topic_9,0.7530659,Positive
"Take most of the old residential buildings along the water in Midtown that are still standing. They look bland and most aren't historically preserved because they were built to house the working class, particularly rail workers who built the El and subway.",topic_9,-0.597982,Negative
what's that regarding the tallest building?,topic_9,0.0,Neutral
"Worst new project in all of Manhattan possibly the country!  If you go to the Design District in Miami and see the unique architecture each building has, it set the bar for a luxury area.  Hudson is a mall that would only wow in Cincinatti (I’ll never understand the bottle next of people at the blue bottle coffee / bathroom / escalator.",topic_9,-0.6750699,Negative
The shed can become an outdoor performance space bc the roof moves and is powered by an electric car battery. Check the promo info from the architects for more “fun” facts.,topic_9,0.46211717,Positive
I don't understand what is the purpose of this structure? Is it an office building or just some type of monument?,topic_9,-0.62306535,Negative
How would this be an office building when it's completely outdoors?,topic_9,-0.22602834,Neutral
this is the most exciting modern architecture since modern times,topic_9,0.7573623,Positive
Negative.  You have to work on site.  And if you're a construction worker you have to go through the longest moat boring-est orientation ever.,topic_9,-0.7113937,Negative
They say march 15th. But the amount of construction left to do says no...,topic_9,-0.57167,Negative
It's walkable architectural sculpture. The Vessel is awesome.,topic_9,0.7442769,Positive
"The architect, Ivo Shandor, favored using unusual materials such as cold-riveted girders with cores of pure selenium, magnesium-tungsten alloys, and gold plated bolts. Shandor designed the building in a fashion exactly like the telemetry trackers NASA uses to identify dead pulsars in deep space.",topic_9,0.19737531,Neutral
Where is this? It intrigues me because no structural columns are seen,topic_9,0.6106769,Positive
It's because architects misunderstand it when scientists tell them that hexagons are a stable shape.,topic_9,-0.45421642,Negative
"""Every architect in the world, including me, only builds penises. Giant sky penises. Just once, I'd like to build a giant vagina.""",topic_9,0.019997345,Neutral
"--the architect, probably",topic_9,-0.0099996645,Neutral
— the architect after a few drinks,topic_9,0.07982977,Neutral
"Just to be clear, would you have preferred that another building be built in its place? I think, had the creators of HY been aware that that is what the public preferred, they would've gladly done that. They just assumed that people wanted space and some things in between the new large buildings.",topic_9,-0.029991005,Neutral
"PARIS — Just over 100 years ago, the leading writers, artists and intellectuals of France banded together to denounce the impending construction of what they called ""the useless and monstrous"" Eiffel Tower. Their petition made them one of French history's laughingstocks.",topic_9,-0.52266544,Negative
The Eiffel Tower was the first modern structure to be built taller than the pyramids.  So in that respect it was more of an engineering feat than just a piece of architecture.,topic_9,0.6106769,Positive
"So, according to you, I have no right to dislike this building?",topic_9,-0.5783634,Negative
"I dislike this building. It's creepy. There are far too many opportunities for committing suicide. It wastes an enormous amount of space. The colors are dull. How many balconies does a building need? If I spit off this balcony, I wonder how long it will take to hit those people down there? It strikes me as an architect's show-off building that the rest of us will have to put up with for decades. I don't like this building.",topic_9,-0.7305939,Negative
Now I see what the architect was getting at with the Indian stepwell inspiration. It’s beautiful from the inside but from the outside it looks like a dumpy pine cone.,topic_9,-0.5783634,Negative
"In terms of architecture, it means ""look how smart I am"".",topic_9,0.6858091,Positive
This is pure Kafka.,topic_9,-0.5298956,Negative
"That’s the tallest “building” in the whole city of Paris, so the views are first-rate. Whereas here you get a view of the side of a super tall building.  Eiffel Tower also has a broadcasting function.",topic_9,0.5783634,Positive
This would have been much better as an elevated park.,topic_9,0.04995837,Neutral
Holy hell it looks so industrial! Nothing but artificial structure.,topic_9,-0.62914515,Negative
B1M YouTube did a pretty good piece on this building a couple months back.,topic_9,0.7013741,Positive
"The Thomas Heatherwick-designed structure, which has stairs climbing 150 feet in the air, has been described by architecture and design writers as a “mythical giant’s wastepaper basket,” “a colossal shawarma,” “an Instagram-friendly panopticon,” and what you would get “if Twitter were a work of architecture.”",topic_9,-0.33637553,Negative
Beautiful....but many redundancies?,topic_9,0.089757785,Neutral
The Chrysler Building on the other hand...,topic_9,-0.06988588,Neutral
A circle can have no point ☯️,topic_9,-0.22602835,Neutral
You’d think that would have occurred to the designer right off the bat but I guess not,topic_9,-0.30950695,Negative
I don’t understand why you’d build something to look at New Jersey.,topic_9,-0.67506987,Negative
The nightmare.,topic_9,-0.6043678,Negative
It was built as a centerpiece for the 1889 World's Fair. At the time it was the tallest man-made structure in the world and represents a triumph of 19th century engineering.,topic_9,0.72589743,Positive
"It actually isn't pure copper, but it's a form of copper painted or clad structure.",topic_9,-0.1586485,Neutral
build a tower for that.,topic_9,-0.07982977,Neutral
That whole development is pretty bleh.,topic_9,-0.72589743,Negative
The place is as desolate as the buildings are tall.,topic_9,-0.680476,Negative
What “security standards” did this not meet?  People on Reddit make up all sorts of Building Codes and rules that are not real.,topic_9,-0.680476,Negative
"What is a “safety standard?”  Where are these “safety standards” written down?  Who enforces the “safety standards?”   There is a Building Code, the city reviews architectural and engineering drawings before issuing a Building Permit.  This project met all the pertinent building codes.",topic_9,-0.14888504,Neutral
Well it depends on which god exists.,topic_9,0.01999733,Neutral
Don’t do the train tracks. I’ve read that it’s extremely traumatic for the crew/engineer. Saw an interview where an engineer had to quit his job because of how it messed him up.,topic_9,-0.72589743,Negative
"It just seems like an unusual project, sitting there with the cameras rolling for months hoping to catch a few suicides.",topic_9,-0.63514894,Negative
"This serves a purpose and is also a landmark. It was built with a private investment so I’m not even sure purpose or functionality is relevant. If someone wants to build something they think is cool, I think they should be able to without a few disturbed people ruining it for everyone else.",topic_9,-0.059928104,Neutral
It’s the designer’s fault that they chose to keep a waist high barrier in a structure that does nothing but up and down. The damning thing here is that the barriers were recommended multiple times and met with insistence that it would ruin the design.,topic_9,-0.6910695,Negative
"Another 'success' for Thomas Heatherwick, after 'B for the bang' in Birmingham (bits fell off hitting the public) the 'Garden Bridge' that was never built but cost millions and IMO the worst bus design ever (they had never designed a bus but were friends with Boris Johnson when Mayor of London) the completely impractical expensive and polluting New Bus for London.",topic_9,-0.6858091,Negative
can’t stand this horrible piece of architecture,topic_9,-0.7352223,Negative
M.C.Escher is an architect now?,topic_9,0.0,Neutral
Design 3 - A spiral design that encourages a more evenly-distributed flow of people. Think Guggenheim.,topic_9,0.4381993,Positive
"Design 4 - Softening the structure with synthetic fabric, a colorful alternative to tree canopy. The dark background kinda just happened and does not indicate the designer’s preference of any kind..",topic_9,-0.16838105,Neutral
Trees may be thin on the part next to the building but I think bushes along the edge could come a long way,topic_9,0.4381993,Positive
"As far as enclosing it as prevention, did you mean both externally and internally? Because sadly Bobst Library at NYU had kids jump into the atrium. Was ultimately solved with brass paneling and plexi walls. Very sad to see remedial architecture of this kind. The tragic cousin of hostile architecture :(",topic_9,-0.7064193,Negative
"So... as an amateur landscape architect, you should probably know that trees and shrubs need roots. These roots often take up as much space as the tree itself. So not feasible to put any of that stuff on any of the suspended platforms. Even if you can account for a root box, you are adding so much weight to the structure that was not designed for it. Tree in the middle would be cool if this structure was sitting on soil that can be excavated. Pretty sure there is occupied space underneath.",topic_9,-0.55805224,Negative
"I dig all of these as a redesign from scratch. Designing is fun, and you are doing a bang up job here!",topic_9,0.7487043,Positive
"Architecture's original definition was the design and construction of buildings, which are inherently essential to our survival, useful and protective. The Vessel is a perversion of the word architecture. The Vessel is simply a large artistic sculpture which uses the vernacular of architecture, but has none of the benefits. I also can't help but feel that the form portrays the idea of climbing but getting nowhere. Other monuments exist without essential or useful purpose, but they almost always have a cultural or commemorative meaning tied to their form.",topic_9,-0.28213483,Negative
To call the Vessel Landscape architecture I find even more offensive. Landscape architecture should be even more guided by scientific principals to achieve ecological and humanist intended outcomes.,topic_9,-0.65270674,Negative
why this wasn’t something they considered when it was designed.,topic_9,-0.5298956,Negative
these are awesome. What kind of fabric would be used in design four? What would be strong enough,topic_9,0.7442769,Positive
"For your project, I'd be careful to label it a, ""redesign"" and make it something like, ""If you had to build it again"".",topic_9,0.059928097,Neutral
"Also, it sounds like you're a landscape architecture student, so probably keep it more to that than reinventing the wheel of the structural part of it. Purely thinking of your grade like your professor probably would.",topic_9,-0.1194273,Neutral
redesign is fine.,topic_9,0.4699452,Positive
"Thank you for the vote! And that's a good point - while I think of ways to make the inside cooler, it's important not to undermine the original design.",topic_9,0.6469295,Positive
"Great project and ideas, very thoughtful!",topic_9,0.7442769,Positive
I think design 2 definitely is the most practical solution but damn if it wouldn’t be cool to tilt the whole thing like the Guggenheim. That place is a trip,topic_9,0.19737533,Neutral
"I don't understand much of design, specially architectural. But your designs seem more than just random doodling, and I appreciate that. 1 & 2 looks pretty nice.",topic_9,0.5783634,Positive
Now to the redesigns. I think you have some interesting ideas but I’m opposed to any redesign. It can’t be the job of art and architecture to make suicide impossible. I don’t want to live in a rubber box or have my views obstructed by glass or mesh or anything else. The idea with trees is nice but it’s sending the wrong message.,topic_9,-0.6106769,Negative
I like the concepts you're working with.,topic_9,0.7487043,Positive
"Tbf, the entire building is a deathtrap. The curvature of the Vertical Campus means that part of the entrance needs to be taped off when it snows because ice rolls right off the side of the building. That shit will absolutely fucking annihilate anyone trying to enter on 24th St.",topic_9,-0.71629786,Negative
"I think because its not a ""functional"" building and is classified as ""sculpture"" its not totally subject to ADA ... I'm not totally sure of that though.",topic_9,-0.13909246,Neutral
Thomas Heatherwick took inspiration from Hindu Step-wells in Gujarat and Rajahstan in India ...,topic_9,0.079829775,Neutral
"They knew they could build it and so they would, but they never stopped to think if they should.",topic_9,0.059928097,Neutral
It is quite possibly Heatherwick's worst executed idea in his entire career.,topic_9,-0.72589743,Negative
I love that they built this its so cool.,topic_9,0.7487043,Positive
Still can't believe all of this is built on an elevated platform above a fucking train yard.,topic_9,-0.72589743,Negative
Incredible how it's being supported,topic_9,0.7305939,Positive
"Mexico City is built on top the ruins of Tenochtitlan, the Aztec capital",topic_9,-0.029991,Neutral
"its crazy how visable it is from all over (the west side at lest), and that one building with the observation deck looms so large from so far away...",topic_9,0.46211717,Positive
"Dunno if I’m the only one, but the observation deck building totally reminds me of Stark tower.",topic_9,0.01999733,Neutral
"So weird how it's only on one side of the building, instead of all four sides.  I guess they assume nobody wants to look at NJ from that height.",topic_9,-0.6169093,Negative
"Is that what that is?  An observation deck?  My husband and I can see it from our apartment about 30 blocks uptown and have been arguing about it ever since it appeared.  He thought it was a weird crane in front of the building so that it looked like part of it.  I just think it is a building that is supposed to look like a giant chicken for whatever reason.  It sure is craptastic, no matter what it is.",topic_9,-0.08975778,Neutral
"I like how the Empire State Building is peeking out in the background like, ""remember me?""",topic_9,0.6169093,Positive
"Do cities have a say in how they want their buildings to look? I know cities have buildings laws and all that, but can a city reject a building if it doesn't fit in with the cities general aesthetic?",topic_9,-0.25429553,Negative
Stop building shaming.,topic_9,-0.680476,Negative
It is amazing how generic they all look considering the number of top architects involved in some of the buildings. I assume cost constraints have limited ambition. The most interesting one (but that's relative) looks to be the Bjark Ingels spiral.,topic_9,0.14888503,Neutral
"When it was being built i thought to myself ""It better not be a big stick, theres gotta be some cool design at the top""",topic_9,0.492988,Positive
"Nope its just a ""hey look at me building"" its the Jake Paul of our skyline",topic_9,0.01999733,Neutral
minecraft tower,topic_9,0.19737533,Neutral
Your schtick stinks.  What would you prefer the buildings to look like?  Everyone’s a critic.,topic_9,-0.7013741,Negative
"In general I prefer older architecture like they chrysler, empire state, and ge building.  But for new buildings it looks pretty good but yeah, I'm not a huge fan of all glass buildings.  Something like the shard in london is pretty cool looking.",topic_9,0.65270674,Positive
"That stairwell is absolutely disgusting. I feel the same way about the oculus with those awful spikes. I don't understand who likes these absurd abstract designs in modern architecture. Tear down gorgeous buildings like Penn Station (I know, it's not the same people) and build these atrocities, what the fuck New York?",topic_9,-0.7352223,Negative
Stop building shaming.,topic_9,-0.680476,Negative
I am a construction worker (carpenter) that spent 2 years working on the 3rd building from the left.... AMA,topic_9,0.38847268,Positive
Are you a construction worker (carpenter) that spent 2 years working on the 3rd building from the left?,topic_9,0.04995837,Neutral
Oh gotcha they are not the GC where I was working. It was Tishman and Related.,topic_9,-0.3274774,Negative
3rd building from left is tower D. Which building you in,topic_9,0.04995837,Neutral
Also they are building a huge retail base,topic_9,0.5783634,Positive
"We are, or at least were, in the midst of another skyscraper boom. This one just happens to be defined by today's architectural stylings.",topic_9,0.19737534,Neutral
"Glass and steel, no imagination. ""Great Architecture"" now means ""LOOK! We put a CURVE in it!""",topic_9,0.46211717,Positive
You must think the architecture in Houston Texas is 'pretty cool' too.,topic_9,0.641077,Positive
What the fuck. I’ve never seen this building. Can’t wait to visit!,topic_9,0.23549573,Neutral
"Hmmm, do they look the same?",topic_9,0.0,Neutral
This is visually overwhelming. It's a nightmare if anything. Probably seemed like a good idea on paper. But hey that's just my opinion.,topic_9,-0.6469295,Negative
"It isn't a building, it's a walkway",topic_9,-0.06988588,Neutral
This architecture is so satisfying to my eyes,topic_9,0.7530659,Positive
"Colossal design oversight which shows how closely our environment is related to each of our lives, as well as a mirror revealing the general well-being of the public at large in our time. As an architect myself, this smells of the same critical lack of class awareness which has caused many of our evolving urban planning deficits. People look up at the giant expensive stairway to nowhere and they feel incredibly small and insignificant. They see a world that doesn't care nor have a place for them. They see hidden cogs of an economic engine completely content to churn them into grease for the axle of greed on which we are all forced to collectively place our hopes for a better future.",topic_9,-0.4053213,Negative
"The point is to look cool. It's an art piece, not meant to be a functional building.",topic_9,-0.19737531,Neutral
Yeah its just an obnoxious flex to prove that they could build it,topic_9,-0.52266544,Negative
If your not familiar look up High Place Phenomenon.,topic_9,0.11942729,Neutral
Insert Joseph Stalin quote about his son,topic_9,-0.36270747,Negative
This reminds me of a poem from Bojack Horseman. I always found it very beautiful but profoundly sad:,topic_9,-0.35399172,Negative
It’s a terrifying thought.,topic_9,-0.66403675,Negative
I think trampolines would be better,topic_9,-0.07982977,Neutral
"They don't call it ""brutalist architecture"" for nothing.",topic_9,-0.641077,Negative
Not brutalist in style but it is in practice,topic_9,-0.3004371,Negative
Also a beautiful place to die,topic_9,0.7211323,Positive
"I'm more into romanesque, do you have any suggestions?",topic_9,0.14888504,Neutral
Dystopian industrial complex-esque.,topic_9,-0.43819928,Negative
"""build it and they will come"".",topic_9,0.33637553,Positive
not brutalist enough,topic_9,-0.5441271,Negative
I'm not going to lie it looks amazing but it also looks like a waste of money but I'm not an engineer. Just seems like it could be more efficient at a glance,topic_9,0.06988588,Neutral
Or industrial mortem,topic_9,-0.12927258,Neutral
That’s brutalist man,topic_9,-0.7064193,Negative
Seems a bit brutalist,topic_9,-0.63514894,Negative
That’s what I thought. Call of the void.,topic_9,-0.1292726,Neutral
"Call of The Void are a somewhat scientific term. You should look up the scientific explanation of it. As the other guy said, the moth and the flame.",topic_9,0.0,Neutral
Is the buddy system why the one guy is being drug there at the top left ?,topic_9,-0.07982977,Neutral
"Look up ""Sarco Device"".",topic_9,0.029991005,Neutral
The billionaire who built it didn't want to change the aesthetics,topic_9,-0.41364443,Negative
"I must have turned into a callous asshole, because I agree with him. Why should he have to? It's a major destination for architects because nothing else like it exists in the world.",topic_9,-0.641077,Negative
Designs get adapted and changed all the time. Imagine building an online service and not wanting to change the design to improve the user experience.,topic_9,-0.28213483,Negative
"Like, the main purpose of design in the first place is not the aesthetics, but form that supports function. If it doesn’t function well, change and adapt. Because watching people die is a terrible user experience.",topic_9,-0.65840906,Negative
The billionaire who built it didn't want to change the aesthetics (for better barriers),topic_9,-0.48538113,Negative
After 3 or 4 the architect probably joined them.,topic_9,0.009999666,Neutral
Not Thomas Heatherwick. He's a complete egocentric.,topic_9,-0.680476,Negative
It was a federal program? I thought it was at the state level.,topic_9,-0.06988589,Neutral
"It was distressed in the sense it was an industrial wasteland and largely unused before it was built. That change with what they built, which is clearly not designed for poor people, but the area was pretty derelict before.",topic_9,-0.66403675,Negative
Imagine thinking architecture is not an art,topic_9,-0.52266544,Negative
It technically did.  The construction workers fed their families and kept a roof over their head for the construction of it.   And still does with maintenance.,topic_9,0.23549576,Neutral
Office buildings are working spaces.,topic_9,0.26362482,Positive
"Good job, you've pointed out something bad. How do you suggest we fix it? Do you have an effective and efficient replacement for the world's most durable building materials?",topic_9,-0.3004371,Negative
"Good job, you've pointed out something bad. How do you suggest we fix it? Do you have an effective and efficient replacement for the world's most durable building materials?",topic_9,-0.3004371,Negative
"A beautifully crafted bronze statue gifted by an ally, symbolising liberty, democracy, and hope",topic_9,0.73978305,Positive
"Well, the Statue of Liberty was a gift from France and the Empire State building has housed countless businesses and workers over the 90 years since it opened. So, no neither of them were wastes of money.",topic_9,0.1586485,Neutral
But imagine if they WERE brutalist! Think of how many more OFFICES they could fit! :P,topic_9,-0.6043678,Negative
