Document,Topic,roberta_polarity,roberta_sentiment
Incredible documentary,topic_12,0.7064193,Positive
"Not a huge Malcom Gladwell  fan, but he had some interesting stuff about suicide and mentions the Golden Gate Bridge as an example. From what I can remember: they closed the Golden Gate Bridge to repair it, and suicide rates dropped. Apparently they way you commit suicide is just as important as the act itself.",topic_12,-0.08975777,Neutral
https://amp.theguardian.com/us-news/2024/jan/03/golden-gate-bridge-suicide-prevention-net-completed,topic_12,-0.009999668,Neutral
I heard this volunteer org on golden gate suicide prevention was founded by someone who jumped and survived. He/she started the org because after jumping he/she realized that she wanted to live.,topic_12,0.03997867,Neutral
"One of my local hot spots (NY) is the Kingston Rhinecliff Bridge. It’s high over the Hudson with low guide rails. Beautiful views, but it’s best seen from inside a moving vehicle because of next to no amenities on either side and continuous crosswinds. It’s been a jumper magnet since it opened in the 50s, and when the wind is up it’s an unsettling experience even in a heavy vehicle. You get on the bridge, and your first instinct is to get across the thing as soon as possible. It’s safe, but it’s never going to feel safe.",topic_12,0.43008423,Positive
"Knowing all that, in their eternal wisdom, the state decided that what the bridge needed was…a pedestrian walkway and bike paths, shoehorned into the existing travel lanes.",topic_12,0.13909245,Neutral
more crashes because vehicle lanes are several feet narrower,topic_12,-0.5783634,Negative
bigger traffic backups because now the crossing experience is that much more dangerous both in perception and reality.,topic_12,-0.69625765,Negative
"The beauty and symbolism of the structure itself probably made it appealing. The below paper talks about survivors of suicide attempts at the Golden Gate Bridge, all of whom said they would only have commit suicide there.",topic_12,0.39693043,Positive
http://depts.washington.edu/psychres/wordpress/wp-content/uploads/2017/07/100-Papers-in-Clinical-Psychiatry-Suicide-Suicide-survivors.-A-follow-up-study-of-persons-who-survived-jumping-from-the-Golden-Gate-and-San-Francisco-Oakland-Bay-Bridges.pdf,topic_12,-0.08975778,Neutral
They never closed the Golden Gate Bridge…. At least now it has nets now I think.,topic_12,-0.069885895,Neutral
The Golden Gate Bridge serves a utilitarian function this doesn’t. It’s a grim cost benefit.,topic_12,-0.641077,Negative
https://www.eurekalert.org/news-releases/472259,topic_12,0.06988589,Neutral
"WTF is this, a bridge to nowhere?",topic_12,-0.71629786,Negative
"So, yes, a bridge to nowhere.",topic_12,-0.46211717,Negative
"Let’s just say they built a Calatrava bridge, but didn’t have a river for it, so they created one.",topic_12,-0.37994897,Negative
EDIT: And the Garden Bridge would have been a blight on the Thames and also inaccesible to disabled people.,topic_12,-0.7211323,Negative
"Would you also not want the eiffel tower or the golden gate bridge shown in media, since they’re suicide destinations?",topic_12,-0.5849799,Negative
Golden gate bridge has entered the chat,topic_12,0.12927258,Neutral
"Mall was in NY, bridge was near the skatepark in Denver on platt river",topic_12,0.04995837,Neutral
right. people jump off the Golden Gate bridge all the time - does that make the bridge a failure?,topic_12,-0.5783634,Negative
"I think the point is that the bridge hasn't failed at being a bridge, but the Vessel has failed at being an experiential observation platform because people decided it can't function as that because of people.",topic_12,-0.55805224,Negative
Are you comparing a piece of interactive public art with a bridge? What was a bridge constructed for? And why was the Vessel constructed?,topic_12,-0.16838105,Neutral
"In case you're new to the world, The Golden Gate Bridge is one of the most photographed, painted and mythologized structures in the world. It may function as a bridge but it exists in our psyche as public art.",topic_12,0.6169093,Positive
Are you comparing a piece of interactive public art with a bridge?,topic_12,-0.21651806,Neutral
"He has a point though. If the Golden Gate Bridge served no purpose other than being art, yeah they'd probably consider closing it due to the rate of suicides.",topic_12,-0.62306535,Negative
"Believe it or not, structures can be both. See: Brooklyn Bridge, Chrysler Building, Sydney Opera House, etc. etc.",topic_12,0.07982977,Neutral
Also I guarantee you the architects and engineers thought of this as a piece of public art in addition to a bridge.,topic_12,-0.08975778,Neutral
How do you post something like this but lack the ability to understand something like the Golden Gate Bridge can and is considered art?,topic_12,-0.6169093,Negative
"No, his point is that the Vessel is art constructed as art, with no utilitarian purpose beyond the aesthetic, so comparisons of any kind to the Golden Gate Bridge, a key piece of infrastructure for an entire region, regarding the closures are fundamentally insane.",topic_12,-0.55805224,Negative
"Imagine calling one of the most photographed, iconic, painted, recognizable structures in the entire world ""just a bridge.""",topic_12,-0.29131263,Negative
"Time to knock down all those multi-story buildings too then i guess. Convert all the bridges to tunnels too while we’re at it. Oh and no more trains, can’t risk people jumping in front of them.",topic_12,-0.63514894,Negative
"How the fuck does that make any sense… and even if you were right, what do you propose we do? Put cages around every staircase, elevated pathway, bridge, etc in the city? If someone jumps, you don’t blame the bridge or its architect for not putting some pillows at the bottom of it.",topic_12,-0.7211323,Negative
"Nah, there's a strong bridge and tunnel circle jerk on this sub that spams NY Post articles and gloats about how the city is a hellscape from their basement",topic_12,-0.66403675,Negative
